Code,Entity,PredefinedType,Name,Entity_NL,Definition,Definition_NL,Description_NL,ParentClassCode,Uid,Domain
IfcSensorRAINSENSOR,IfcSensor,RAINSENSOR,Rain Sensor,Rain Sensor,A device that senses or collects rainfall related information.,Een apparaat dat regenval opwekt of opraakt.,"Technische opmerking: Omdat deze klasse een 'Vooraf gedefinieerd Type' is in IFC, wat een specialisatie van de bovenliggende klasse betekent, in IFC moet het worden vertegenwoordigd door de bovenliggende klasse, met alle relevante eigenschappen en kenmerken.",IfcSensor,,IfcBuildingControlsDomain
IfcSensorSMOKESENSOR,IfcSensor,SMOKESENSOR,Smoke Sensor,Rookmelder,A device that senses or detects smoke.,Een apparaat dat rook senseert of detecteert.,"Technische opmerking: Omdat deze klasse een 'Vooraf gedefinieerd Type' is in IFC, wat een specialisatie van de bovenliggende klasse betekent, in IFC moet het worden vertegenwoordigd door de bovenliggende klasse, met alle relevante eigenschappen en kenmerken.",IfcSensor,,IfcBuildingControlsDomain
IfcSensorSNOWDEPTHSENSOR,IfcSensor,SNOWDEPTHSENSOR,Snow Depth Sensor,Sneeuw Diepte Sensor,A device that senses or measures the depth of snowfall.,Een apparaat dat de diepte van sneeuw voelt of meet.,"Technische opmerking: Omdat deze klasse een 'Vooraf gedefinieerd Type' is in IFC, wat een specialisatie van de bovenliggende klasse betekent, in IFC moet het worden vertegenwoordigd door de bovenliggende klasse, met alle relevante eigenschappen en kenmerken.",IfcSensor,,IfcBuildingControlsDomain
IfcSensorSOUNDSENSOR,IfcSensor,SOUNDSENSOR,Sound Sensor,Geluid Sensor,A device that senses or detects sound.,Een apparaat dat geluid voelt of detecteert.,"Technische opmerking: Omdat deze klasse een 'Vooraf gedefinieerd Type' is in IFC, wat een specialisatie van de bovenliggende klasse betekent, in IFC moet het worden vertegenwoordigd door de bovenliggende klasse, met alle relevante eigenschappen en kenmerken.",IfcSensor,,IfcBuildingControlsDomain
IfcSensorTEMPERATURESENSOR,IfcSensor,TEMPERATURESENSOR,Temperature Sensor,Temperatuursensor,A device that senses or detects temperature.,Een apparaat dat de temperatuur voelt of detecteert.,"Technische opmerking: Omdat deze klasse een 'Vooraf gedefinieerd Type' is in IFC, wat een specialisatie van de bovenliggende klasse betekent, in IFC moet het worden vertegenwoordigd door de bovenliggende klasse, met alle relevante eigenschappen en kenmerken.",IfcSensor,,IfcBuildingControlsDomain
IfcSensorTRAINSENSOR,IfcSensor,TRAINSENSOR,T Rain Sensor,T Rain Sensor,"A device, usually attached to the rear end of the last vehicle of a train, acting on a fixed equipment to give an indication that the train is complete.","Een apparaat, meestal bevestigd aan de achterkant van het laatste voertuig van de trein, het handelen met een vaste uitrusting om een indicatie te geven van de trein.","Technische opmerking: Omdat deze klasse een 'Vooraf gedefinieerd Type' is in IFC, wat een specialisatie van de bovenliggende klasse betekent, in IFC moet het worden vertegenwoordigd door de bovenliggende klasse, met alle relevante eigenschappen en kenmerken.",IfcSensor,,IfcBuildingControlsDomain
IfcSensorTURNOUTCLOSURESENSOR,IfcSensor,TURNOUTCLOSURESENSOR,Turnout Closure Sensor,Schakel Sluitingssensor uit,A device that senses or detects the position of a blade of a turnout.,Een apparaat dat de positie van een blad van een opkomst voelt of detecteert.,"Technische opmerking: Omdat deze klasse een 'Vooraf gedefinieerd Type' is in IFC, wat een specialisatie van de bovenliggende klasse betekent, in IFC moet het worden vertegenwoordigd door de bovenliggende klasse, met alle relevante eigenschappen en kenmerken.",IfcSensor,,IfcBuildingControlsDomain
IfcSensorWHEELSENSOR,IfcSensor,WHEELSENSOR,Wheel Sensor,Wiel Sensor,A device that senses or detects the passage of a wheel.,Een apparaat dat de doorgang van een wiel voelt of detecteert.,"Technische opmerking: Omdat deze klasse een 'Vooraf gedefinieerd Type' is in IFC, wat een specialisatie van de bovenliggende klasse betekent, in IFC moet het worden vertegenwoordigd door de bovenliggende klasse, met alle relevante eigenschappen en kenmerken.",IfcSensor,,IfcBuildingControlsDomain
IfcSensorWINDSENSOR,IfcSensor,WINDSENSOR,Wind Sensor,Wind Sensor,A device that senses or detects airflow speed and direction.,Een apparaat dat luchtstroomsnelheid en richting detecteert of detecteert.,"Technische opmerking: Omdat deze klasse een 'Vooraf gedefinieerd Type' is in IFC, wat een specialisatie van de bovenliggende klasse betekent, in IFC moet het worden vertegenwoordigd door de bovenliggende klasse, met alle relevante eigenschappen en kenmerken.",IfcSensor,,IfcBuildingControlsDomain
IfcUnitaryControlElementALARMPANEL,IfcUnitaryControlElement,ALARMPANEL,Alarm Panel,Alarm paneel,A control element at which alarms are annunciated.,Een controle-element waarbij alarmen worden uitgebannen.,"Technische opmerking: Omdat deze klasse een 'Vooraf gedefinieerd Type' is in IFC, wat een specialisatie van de bovenliggende klasse betekent, in IFC moet het worden vertegenwoordigd door de bovenliggende klasse, met alle relevante eigenschappen en kenmerken.",IfcUnitaryControlElement,,IfcBuildingControlsDomain
IfcUnitaryControlElementBASESTATIONCONTROLLER,IfcUnitaryControlElement,BASESTATIONCONTROLLER,Base Station Controller,Basis Bestuurder,"A base station controller (BSC) is a network component with the functions for controlling one or more base transceiver stations. BSC is responsible for the management of various interfaces, wireless resources and parameters, the signalling processing of call establishment and the channel allocation in the cell.","Een basisstation controller (BSC) is een netwerkcomponent met de functies voor het besturen van één of meer basistransceiverstations. BSC is verantwoordelijk voor het beheer van verschillende interfaces, draadloze middelen en parameters, het teken van de verwerking van de oproep en de kanaaltoewijzing in de cel.","Technische opmerking: Omdat deze klasse een 'Vooraf gedefinieerd Type' is in IFC, wat een specialisatie van de bovenliggende klasse betekent, in IFC moet het worden vertegenwoordigd door de bovenliggende klasse, met alle relevante eigenschappen en kenmerken.",IfcUnitaryControlElement,,IfcBuildingControlsDomain
IfcUnitaryControlElementCOMBINED,IfcUnitaryControlElement,COMBINED,Combined,Gecombineerd,Combination of at least two predefined types of unitary control element.,Combinatie van ten minste twee vooraf gedefinieerde types van unitary control element.,"Technische opmerking: Omdat deze klasse een 'Vooraf gedefinieerd Type' is in IFC, wat een specialisatie van de bovenliggende klasse betekent, in IFC moet het worden vertegenwoordigd door de bovenliggende klasse, met alle relevante eigenschappen en kenmerken.",IfcUnitaryControlElement,,IfcBuildingControlsDomain
IfcUnitaryControlElementCONTROLPANEL,IfcUnitaryControlElement,CONTROLPANEL,Control Panel,Controlepaneel,"A control element at which devices that control or monitor the operation of a site, building or part of a building are located","Een controle-element op welke apparaten die de werking van een site, gebouw of een deel van een gebouw controleren of controleren, zich bevinden","Technische opmerking: Omdat deze klasse een 'Vooraf gedefinieerd Type' is in IFC, wat een specialisatie van de bovenliggende klasse betekent, in IFC moet het worden vertegenwoordigd door de bovenliggende klasse, met alle relevante eigenschappen en kenmerken.",IfcUnitaryControlElement,,IfcBuildingControlsDomain
IfcUnitaryControlElementGASDETECTIONPANEL,IfcUnitaryControlElement,GASDETECTIONPANEL,Gas Detection Panel,Gas Detectie Paneel,A control element at which the detection of gas is annunciated.,Een controle-element waarbij de opsporing van gas wordt uitgebannen.,"Technische opmerking: Omdat deze klasse een 'Vooraf gedefinieerd Type' is in IFC, wat een specialisatie van de bovenliggende klasse betekent, in IFC moet het worden vertegenwoordigd door de bovenliggende klasse, met alle relevante eigenschappen en kenmerken.",IfcUnitaryControlElement,,IfcBuildingControlsDomain
IfcUnitaryControlElementHUMIDISTAT,IfcUnitaryControlElement,HUMIDISTAT,Humidistat,Humidistaat,A control element that senses and regulates the humidity of a system or space so that the humidity is maintained near a desired setpoint.,Een controle-element dat de luchtvochtigheid van een systeem of ruimte bezielt en regelt zodat de luchtvochtigheid dicht bij een gewenste set blijft.,"Technische opmerking: Omdat deze klasse een 'Vooraf gedefinieerd Type' is in IFC, wat een specialisatie van de bovenliggende klasse betekent, in IFC moet het worden vertegenwoordigd door de bovenliggende klasse, met alle relevante eigenschappen en kenmerken.",IfcUnitaryControlElement,,IfcBuildingControlsDomain
IfcUnitaryControlElementINDICATORPANEL,IfcUnitaryControlElement,INDICATORPANEL,Indicator Panel,Indicator paneel,"A control element at which equipment operational status, condition, safety state or other required parameters are indicated.","Een controleelement waarbij de operationele status van de apparatuur, conditie, veiligheidsstaat of andere vereiste parameters worden aangegeven.","Technische opmerking: Omdat deze klasse een 'Vooraf gedefinieerd Type' is in IFC, wat een specialisatie van de bovenliggende klasse betekent, in IFC moet het worden vertegenwoordigd door de bovenliggende klasse, met alle relevante eigenschappen en kenmerken.",IfcUnitaryControlElement,,IfcBuildingControlsDomain
IfcUnitaryControlElementMIMICPANEL,IfcUnitaryControlElement,MIMICPANEL,Mimic Panel,Mimic Paneel,A control element at which information that is available elsewhere is repeated or 'mimicked'.,"Een controle-element waarop informatie die elders beschikbaar is, wordt herhaald of 'gemimicked'.","Technische opmerking: Omdat deze klasse een 'Vooraf gedefinieerd Type' is in IFC, wat een specialisatie van de bovenliggende klasse betekent, in IFC moet het worden vertegenwoordigd door de bovenliggende klasse, met alle relevante eigenschappen en kenmerken.",IfcUnitaryControlElement,,IfcBuildingControlsDomain
IfcUnitaryControlElementTHERMOSTAT,IfcUnitaryControlElement,THERMOSTAT,Thermostat,Thermostaat,"A control element that senses and regulates the temperature of an element, system or space so that the temperature is maintained near a desired setpoint.","Een besturingselement dat de temperatuur van een element, systeem of ruimte detecteert en regelt zodat de temperatuur dicht bij de gewenste temperatuur wordt gehouden.","Technische opmerking: Omdat deze klasse een 'Vooraf gedefinieerd Type' is in IFC, wat een specialisatie van de bovenliggende klasse betekent, in IFC moet het worden vertegenwoordigd door de bovenliggende klasse, met alle relevante eigenschappen en kenmerken.",IfcUnitaryControlElement,,IfcBuildingControlsDomain
IfcUnitaryControlElementWEATHERSTATION,IfcUnitaryControlElement,WEATHERSTATION,Weather Station,Weerstation,"A control element that senses multiple climate properties such as temperature, humidity, pressure, wind, and rain.","Een controle-element dat meerdere klimaateigenschappen voelt, zoals temperatuur, vochtigheid, druk, wind en regen.","Technische opmerking: Omdat deze klasse een 'Vooraf gedefinieerd Type' is in IFC, wat een specialisatie van de bovenliggende klasse betekent, in IFC moet het worden vertegenwoordigd door de bovenliggende klasse, met alle relevante eigenschappen en kenmerken.",IfcUnitaryControlElement,,IfcBuildingControlsDomain
IfcAudioVisualApplianceAMPLIFIER,IfcAudioVisualAppliance,AMPLIFIER,Amplifier,Versterker,A device that receives an audio signal and amplifies it to play through speakers.,Een apparaat dat een audiosignaal ontvangt en dit versterkt om door sprekers af te spelen.,"Technische opmerking: Omdat deze klasse een 'Vooraf gedefinieerd Type' is in IFC, wat een specialisatie van de bovenliggende klasse betekent, in IFC moet het worden vertegenwoordigd door de bovenliggende klasse, met alle relevante eigenschappen en kenmerken.",IfcAudioVisualAppliance,,IfcElectricalDomain
IfcAudioVisualApplianceCAMERA,IfcAudioVisualAppliance,CAMERA,Camera,camera,"A device that records images, either as a still photograph or as moving images known as videos or movies. Note that a camera may operate with light from the visible spectrum or from other parts of the electromagnetic spectrum such as infrared or ultraviolet.","Een apparaat dat afbeeldingen opneemt, als een nog steeds foto of als bewegende afbeeldingen, bekend als video's of films. Merk op dat een camera kan functioneren met licht vanuit het zichtbare spectrum of vanuit andere delen van het elektromagnetische spectrum, zoals infrastructuur of ultraviolet.","Technische opmerking: Omdat deze klasse een 'Vooraf gedefinieerd Type' is in IFC, wat een specialisatie van de bovenliggende klasse betekent, in IFC moet het worden vertegenwoordigd door de bovenliggende klasse, met alle relevante eigenschappen en kenmerken.",IfcAudioVisualAppliance,,IfcElectricalDomain
IfcAudioVisualApplianceCOMMUNICATIONTERMINAL,IfcAudioVisualAppliance,COMMUNICATIONTERMINAL,Communication Terminal,Communicatie Terminal,"A communication terminal is an audio communication device that is usually installed along transportation infrastructure (railways, roads, tunnels etc.) in order to be used by the general public or operation agents for communication. It may specifically be used to make calls to emergency services in tunnels.","Een communicatie-terminal is een audio-verbindingsapparaat dat meestal wordt geïnstalleerd langs de transportinfrastructuur (spoorwegen, wegen, tunnels etc. om te worden gebruikt door het grote publiek of de operatoren voor communicatie. Het kan specifiek worden gebruikt voor oproepen aan hulpdiensten in tunnels.","Technische opmerking: Omdat deze klasse een 'Vooraf gedefinieerd Type' is in IFC, wat een specialisatie van de bovenliggende klasse betekent, in IFC moet het worden vertegenwoordigd door de bovenliggende klasse, met alle relevante eigenschappen en kenmerken.",IfcAudioVisualAppliance,,IfcElectricalDomain
IfcAudioVisualApplianceDISPLAY,IfcAudioVisualAppliance,DISPLAY,Display,Weergeven,An electronic device that represents information in visual form such as a flat-panel display or television.,"Een elektronisch apparaat dat informatie in visuele vorm weergeeft, zoals een flatpaneelscherm of televisie.","Technische opmerking: Omdat deze klasse een 'Vooraf gedefinieerd Type' is in IFC, wat een specialisatie van de bovenliggende klasse betekent, in IFC moet het worden vertegenwoordigd door de bovenliggende klasse, met alle relevante eigenschappen en kenmerken.",IfcAudioVisualAppliance,,IfcElectricalDomain
IfcAudioVisualApplianceMICROPHONE,IfcAudioVisualAppliance,MICROPHONE,Microphone,Microfoon,"An acoustic-to-electric transducer or sensor that converts sound into an electrical signal. Microphones types in use include electromagnetic induction (dynamic microphones), capacitance change (condenser microphones) or piezoelectric generation to produce the signal from mechanical vibration.","Een elektrische transducer of sensor die geluid converteert naar een elektrisch signaal. Het gebruik van microfoons omvat elektromagnetische inductie (dynamische microfoonen), capaciteitswijziging (condensator microfoonen) of de piezo-elektrische opwekking om het signaal van mechanische trillingen te laten zien.","Technische opmerking: Omdat deze klasse een 'Vooraf gedefinieerd Type' is in IFC, wat een specialisatie van de bovenliggende klasse betekent, in IFC moet het worden vertegenwoordigd door de bovenliggende klasse, met alle relevante eigenschappen en kenmerken.",IfcAudioVisualAppliance,,IfcElectricalDomain
IfcAudioVisualAppliancePLAYER,IfcAudioVisualAppliance,PLAYER,P Layer,P laag,"A device that plays audio and/or video content directly or to another device, having fixed or removable storage media.",Een apparaat dat audio- en/of videoinhoud direct of naar een ander apparaat afspeelt met vaste of verwijderbare opslagmedia.,"Technische opmerking: Omdat deze klasse een 'Vooraf gedefinieerd Type' is in IFC, wat een specialisatie van de bovenliggende klasse betekent, in IFC moet het worden vertegenwoordigd door de bovenliggende klasse, met alle relevante eigenschappen en kenmerken.",IfcAudioVisualAppliance,,IfcElectricalDomain
IfcAudioVisualAppliancePROJECTOR,IfcAudioVisualAppliance,PROJECTOR,Projector,Projector,"An apparatus for projecting a picture on a screen. Whether the device is an overhead, slide projector, or a film projector, it is usually referred to as simply a projector.","Een apparaat voor het projecteren van een afbeelding op een scherm. Of het apparaat een overheen, slide projector of een filmprojector is, het wordt meestal aangeduid als gewoon een projector.","Technische opmerking: Omdat deze klasse een 'Vooraf gedefinieerd Type' is in IFC, wat een specialisatie van de bovenliggende klasse betekent, in IFC moet het worden vertegenwoordigd door de bovenliggende klasse, met alle relevante eigenschappen en kenmerken.",IfcAudioVisualAppliance,,IfcElectricalDomain
IfcAudioVisualApplianceRECEIVER,IfcAudioVisualAppliance,RECEIVER,Receiver,Ontvanger,"A device that receives audio and/or video signals, switches sources, and amplifies signals to play through speakers.","Een apparaat dat audio- en/of video-signalen ontvangt, schakelt van bronnen en versterkt signalen om door sprekers af te spelen.","Technische opmerking: Omdat deze klasse een 'Vooraf gedefinieerd Type' is in IFC, wat een specialisatie van de bovenliggende klasse betekent, in IFC moet het worden vertegenwoordigd door de bovenliggende klasse, met alle relevante eigenschappen en kenmerken.",IfcAudioVisualAppliance,,IfcElectricalDomain
IfcAudioVisualApplianceRECORDINGEQUIPMENT,IfcAudioVisualAppliance,RECORDINGEQUIPMENT,Recording Equipment,Uitrusting opnemen,A recording equipment is a device that records telephone calls or other types of audio data. It also provides the function of archiving and immediate replay.,Een opnameapparaat is een apparaat dat telefoongesprekken of andere soorten audiogegevens opneemt. Het zorgt ook voor de functie van archivering en onmiddellijke replay.,"Technische opmerking: Omdat deze klasse een 'Vooraf gedefinieerd Type' is in IFC, wat een specialisatie van de bovenliggende klasse betekent, in IFC moet het worden vertegenwoordigd door de bovenliggende klasse, met alle relevante eigenschappen en kenmerken.",IfcAudioVisualAppliance,,IfcElectricalDomain
IfcAudioVisualApplianceSPEAKER,IfcAudioVisualAppliance,SPEAKER,Speaker,Spreker,"A loudspeaker, speaker, or speaker system is an electroacoustical transducer that converts an electrical signal to sound.","Een luidspreker, spreker of luidsprekersysteem is een elektroacoustische transducator die een elektrisch signaal naar geluid converteert.","Technische opmerking: Omdat deze klasse een 'Vooraf gedefinieerd Type' is in IFC, wat een specialisatie van de bovenliggende klasse betekent, in IFC moet het worden vertegenwoordigd door de bovenliggende klasse, met alle relevante eigenschappen en kenmerken.",IfcAudioVisualAppliance,,IfcElectricalDomain
IfcAudioVisualApplianceSWITCHER,IfcAudioVisualAppliance,SWITCHER,Switcher,Wisselaar,"A device that receives audio and/or video signals, switches sources, and transmits signals to downstream devices.","Een apparaat dat audio- en/of video-signalen ontvangt, van bron wisselt en signalen uitzendt naar downstream-apparaten.","Technische opmerking: Omdat deze klasse een 'Vooraf gedefinieerd Type' is in IFC, wat een specialisatie van de bovenliggende klasse betekent, in IFC moet het worden vertegenwoordigd door de bovenliggende klasse, met alle relevante eigenschappen en kenmerken.",IfcAudioVisualAppliance,,IfcElectricalDomain
IfcAudioVisualApplianceTELEPHONE,IfcAudioVisualAppliance,TELEPHONE,Telephone,Telefoon,"A telecommunications device that is used to transmit and receive sound, and optionally video.",Een telecommunicatieapparaat dat wordt gebruikt voor het verzenden en ontvangen van geluid en eventueel video.,"Technische opmerking: Omdat deze klasse een 'Vooraf gedefinieerd Type' is in IFC, wat een specialisatie van de bovenliggende klasse betekent, in IFC moet het worden vertegenwoordigd door de bovenliggende klasse, met alle relevante eigenschappen en kenmerken.",IfcAudioVisualAppliance,,IfcElectricalDomain
IfcAudioVisualApplianceTUNER,IfcAudioVisualAppliance,TUNER,Tuner,Tuner,"An electronic receiver that detects, demodulates, and amplifies transmitted signals.","Een elektronische ontvanger die verzonden signalen detecteert, degradeert en versterkt.","Technische opmerking: Omdat deze klasse een 'Vooraf gedefinieerd Type' is in IFC, wat een specialisatie van de bovenliggende klasse betekent, in IFC moet het worden vertegenwoordigd door de bovenliggende klasse, met alle relevante eigenschappen en kenmerken.",IfcAudioVisualAppliance,,IfcElectricalDomain
IfcCableCarrierFittingBEND,IfcCableCarrierFitting,BEND,Bend,Buigen,A fitting that changes the route of the cable carrier.,Een passend pak verandert de route van de kabelbaan.,"Technische opmerking: Omdat deze klasse een 'Vooraf gedefinieerd Type' is in IFC, wat een specialisatie van de bovenliggende klasse betekent, in IFC moet het worden vertegenwoordigd door de bovenliggende klasse, met alle relevante eigenschappen en kenmerken.",IfcCableCarrierFitting,,IfcElectricalDomain
IfcCableCarrierFittingCONNECTOR,IfcCableCarrierFitting,CONNECTOR,Connector,Connector,"Connector fitting, typically used to join two ports together within a flow distribution system (e.g., a coupling used to join two duct segments).","Connector passeert, meestal gebruikt om twee poorten samen te voegen binnen een debiteurdistributiesysteem (bijv. een koppeling die wordt gebruikt om twee kanaalsegmenten aan te sluiten).","Technische opmerking: Omdat deze klasse een 'Vooraf gedefinieerd Type' is in IFC, wat een specialisatie van de bovenliggende klasse betekent, in IFC moet het worden vertegenwoordigd door de bovenliggende klasse, met alle relevante eigenschappen en kenmerken.",IfcCableCarrierFitting,,IfcElectricalDomain
IfcCableCarrierFittingCROSS,IfcCableCarrierFitting,CROSS,Cross,Doorkruisen,A fitting at which two branches are taken from the main route of the cable carrier simultaneously.,Een pasvorm waarin twee takken tegelijk uit de hoofdroute van de kabeltransporteur worden gehaald.,"Technische opmerking: Omdat deze klasse een 'Vooraf gedefinieerd Type' is in IFC, wat een specialisatie van de bovenliggende klasse betekent, in IFC moet het worden vertegenwoordigd door de bovenliggende klasse, met alle relevante eigenschappen en kenmerken.",IfcCableCarrierFitting,,IfcElectricalDomain
IfcCableCarrierFittingJUNCTION,IfcCableCarrierFitting,JUNCTION,Junction,Wissel,"A fitting with typically more than two ports used to redistribute flow among the ports and/or to change the direction of flow between connected elements (e.g, tee, cross, wye, etc.).","Een passend product met meestal meer dan twee poorten die gebruikt worden om de stroom te herverdelen over de havens en/of om de richting van de stroom tussen de verbonden elementen te wijzigen (bv. , thee, cross, wye, etc.).","Technische opmerking: Omdat deze klasse een 'Vooraf gedefinieerd Type' is in IFC, wat een specialisatie van de bovenliggende klasse betekent, in IFC moet het worden vertegenwoordigd door de bovenliggende klasse, met alle relevante eigenschappen en kenmerken.",IfcCableCarrierFitting,,IfcElectricalDomain
IfcCableCarrierFittingREDUCER,IfcCableCarrierFitting,REDUCER,Reducer,Verminderder,A fitting that changes the physical size of the main route of the cable carrier.,Een aanpassing die verandert de fysieke grootte van de hoofdroute van de kabelmaatschappij.,"Technische opmerking: Omdat deze klasse een 'Vooraf gedefinieerd Type' is in IFC, wat een specialisatie van de bovenliggende klasse betekent, in IFC moet het worden vertegenwoordigd door de bovenliggende klasse, met alle relevante eigenschappen en kenmerken.",IfcCableCarrierFitting,,IfcElectricalDomain
IfcCableCarrierFittingTEE,IfcCableCarrierFitting,TEE,Tee,Thee,A fitting at which a branch is taken from the main route of the cable carrier.,Een pasvorm waarin een filiaal van de hoofdroute van de kabelmaatschappij wordt genomen.,"Technische opmerking: Omdat deze klasse een 'Vooraf gedefinieerd Type' is in IFC, wat een specialisatie van de bovenliggende klasse betekent, in IFC moet het worden vertegenwoordigd door de bovenliggende klasse, met alle relevante eigenschappen en kenmerken.",IfcCableCarrierFitting,,IfcElectricalDomain
IfcCableCarrierFittingTRANSITION,IfcCableCarrierFitting,TRANSITION,Transition,Transitie,A fitting with typically two ports having different shapes or sizes. Can also be used to change the direction of flow between connected elements.,Een aanpassing met meestal twee poorten met verschillende vormen of groottes. Kan ook worden gebruikt om de richting van de stroom tussen verbonden elementen te veranderen.,"Technische opmerking: Omdat deze klasse een 'Vooraf gedefinieerd Type' is in IFC, wat een specialisatie van de bovenliggende klasse betekent, in IFC moet het worden vertegenwoordigd door de bovenliggende klasse, met alle relevante eigenschappen en kenmerken.",IfcCableCarrierFitting,,IfcElectricalDomain
IfcCableCarrierSegmentCABLEBRACKET,IfcCableCarrierSegment,CABLEBRACKET,Cable Bracket,Kabel Haakje,"A cable bracket is a horizontal cable support fixed at one end only, spaced at intervals, on which cables rest.","Een kabelbeugel is een horizontale kabelondersteuning vastgesteld op slechts één eindpunt, met tussensteken, waarop kabels rusten.","Technische opmerking: Omdat deze klasse een 'Vooraf gedefinieerd Type' is in IFC, wat een specialisatie van de bovenliggende klasse betekent, in IFC moet het worden vertegenwoordigd door de bovenliggende klasse, met alle relevante eigenschappen en kenmerken.",IfcCableCarrierSegment,,IfcElectricalDomain
