Code,Entity,PredefinedType,Name,Entity_NL,Definition,Definition_NL,Description_NL,ParentClassCode,Uid,Domain
IfcActuator,IfcActuator,,Actuator,Actuator,"An actuator is a mechanical device for moving or controlling a mechanism or system. An actuator takes energy, usually created by air, electricity, or liquid, and converts that into some kind of motion.; >","Een actuator is een mechanisch apparaat voor het verplaatsen of beheren van een mechanisme of systeem. Een actuator gebruikt energie, meestal gemaakt door lucht, elektriciteit of vloeistof, en zet die om in een beweging.",,IfcDistributionControlElement,88e31a97-fc93-413c-9a8f-f55d4f201c19,IfcBuildingControlsDomain
IfcAlarm,IfcAlarm,,Alarm,Alarm,An alarm is a device that signals the existence of a condition or situation that is outside the boundaries of normal expectation or that activates such a device.; Alarms include the provision of break glass buttons and manual pull boxes that are used to activate alarms.; >,Een alarm is een apparaat dat het bestaan van een voorwaarde of situatie aangeeft die buiten de normale verwachting ligt of die een dergelijk apparaat activeert.,,IfcDistributionControlElement,90995dc8-ff72-4331-bff5-af4591a13d27,IfcBuildingControlsDomain
IfcController,IfcController,,Controller,Regelaar,A controller is a device that monitors inputs and controls outputs within a building automation system.; A controller may be physical (having placement within a spatial structure) or logical (a software interface or aggregated within a programmable physical controller).; >,Een controller is een apparaat dat inputs en besturingselementen binnen een automatiesysteem van gebouwen controleert.,,IfcDistributionControlElement,7afb752b-f1c9-4813-83a7-ed6599f5cfa0,IfcBuildingControlsDomain
IfcFlowInstrument,IfcFlowInstrument,,Flow Instrument,Stroom Instrument,"A flow instrument reads and displays the value of a particular property of a system at a point, or displays the difference in the value of a property between two points.; Instrumentation is typically for the purpose of determining the value of the property at a point in time. It is not the purpose of an instrument to record or integrate the values over time (although they may be connected to recording devices that do perform such a function). This entity provides for all forms of mechanical flow instrument (thermometers, pressure gauges etc.) and electrical flow instruments (ammeters, voltmeters etc.); >",Een debietinstrument leest en geeft de waarde weer van een bepaalde eigenschap van een systeem op een punt. of toont het verschil in de waarde van een eigenschap tussen twee punten.,,IfcDistributionControlElement,67624ad3-5d2e-4f19-abe4-c8abfa34fd54,IfcBuildingControlsDomain
IfcSensor,IfcSensor,,Sensor,Sensor,A sensor is a device that measures a physical quantity and converts it into a signal which can be read by an observer or by an instrument.; >,Een sensor is een apparaat dat een fysieke hoeveelheid meet en deze omzet in een signaal dat kan worden gelezen door een waarnemer of door een instrument.,,IfcDistributionControlElement,f8dc24f1-371f-42ce-af2b-1102b868f220,IfcBuildingControlsDomain
IfcUnitaryControlElement,IfcUnitaryControlElement,,Unitary Control Element,Unitary Control Element,"A unitary control element combines a number of control components into a single product, such as a thermostat or humidistat.; A unitary control element provides a housing for an aggregation of control or electrical distribution elements that, in combination, perform a singular (unitary) purpose. Each item in the aggregation may have its own geometric representation and location.; >","Een unitary control element combineert een aantal control componenten in één product, zoals een thermostaat of humidistat.",,IfcDistributionControlElement,cfc09c9c-67e9-4354-9a3c-87e3d2f14839,IfcBuildingControlsDomain
IfcPerformanceHistory,IfcPerformanceHistory,,Performance History,Prestatie Geschiedenis,"_IfcPerformanceHistory_ is used to document the actual performance of an occurrence instance over time. It includes machine-measured data from building automation systems and human-specified data such as task and resource usage. The data may represent actual conditions, predictions, or simulations.; The realtime data tracked by performance history takes the form of property sets where all properties are based on time series. Unlike design-based data at occurrences and types, performance-driven data is time-sensitive and may change in realtime by some measurement device. Data may be captured at irregular intervals such as when values change beyond established thresholds, or at regular intervals of specified duration.; Declaration use definition; _IfcPerformanceHistory_ may be declared within a project using _IfcRelDeclares_ where _RelatingContext_ refers to the _IfcProject_ and _RelatedDefinitions_ includes the _IfcPerformanceHistory_. Default units (used for property sets) are indicated by the declaring project. Only top-level objects are declared; nested performance history objects (through _IfcRelNests_) do not participate in such relationship.; >","[[IfcPerformanceHistory]] wordt gebruikt om de werkelijke prestaties van een gebeurtenis na verloop van tijd te documenteren. Het omvat machine-gemeten gegevens uit het bouwen van automatiseringssystemen en personele gegevens zoals taak en hulpbron. De gegevens kunnen werkelijke omstandigheden, voorspellingen of simulaties weergeven.",,IfcControl,e8ca45f2-cf0b-4a93-84ca-ea3c10c7b27e,IfcControlExtension
IfcAudioVisualAppliance,IfcAudioVisualAppliance,,Audio Visual Appliance,Audio-visumapparaat,"An audio-visual appliance is a device that displays, captures, transmits, or receives audio or video.; Audio-visual appliances may be fixed in place or may be able to be moved from one space to another. They may require an electrical supply that may be supplied either by an electrical circuit or provided from a local battery source. Audio-visual appliances may be connected to data circuits including specialist circuits for audio visual purposes only.; >","Een audiovisueel apparaat is een apparaat dat opnames, zendingen, audio of video weergeeft.",,IfcFlowTerminal,d4cea3d5-466c-4f2b-99e8-9c0c621d5d69,IfcElectricalDomain
IfcCableCarrierFitting,IfcCableCarrierFitting,,Cable Carrier Fitting,Kabeldrager koppelstuk,A cable carrier fitting is a fitting that is placed at junction or transition in a cable carrier system.; >,Een kabeldrager is een pasvorm die op een kruispunt of overgang in een kabelvervoersysteem wordt geplaatst.,,IfcFlowFitting,47539a87-e549-4786-85f9-b5b8c8fb705b,IfcElectricalDomain
IfcCableCarrierSegment,IfcCableCarrierSegment,,Cable Carrier Segment,Kabeldrager segment,A cable carrier segment is a flow segment that is specifically used to carry and support cabling.; >,Een kabelbaan is een stroomsegment dat specifiek wordt gebruikt om kabels te dragen en te ondersteunen.,,IfcFlowSegment,cbe43c1f-9ddd-4279-bb40-699045a1e748,IfcElectricalDomain
IfcCableFitting,IfcCableFitting,,Cable Fitting,Kabel koppelstuk,"A cable fitting is a fitting that is placed at a junction, transition or termination in a cable system.; >","Een kabelaansluiting is een pasvorm die op een kruispunt, overgang of beëindiging in een kabelsysteem staat.",,IfcFlowFitting,a981fcc0-253f-4511-8e27-f490e28f4ada,IfcElectricalDomain
IfcCableSegment,IfcCableSegment,,Cable Segment,Kabel,"A cable segment is a flow segment used to carry electrical power, data, or telecommunications signals.; A cable segment is used to typically join two sections of an electrical network or a network of components carrying the electrical service.; >","Een kabelsegment is een stroomsegment dat gebruikt wordt voor het dragen van elektriciteit, data of telecommunicatiesignalen.",,IfcFlowSegment,a16f4db3-e5ef-49a6-98e0-f7c2116a5580,IfcElectricalDomain
IfcCommunicationsAppliance,IfcCommunicationsAppliance,,Communications Appliance,Toestel voor communicatie,A communications appliance transmits and receives electronic or digital information as data or sound.; Communication appliances may be fixed in place or may be able to be moved from one space to another. Communication appliances require an electrical supply that may be supplied either by an electrical circuit or provided from a local battery source.; >,Een communicatiemiddel zendt elektronische of digitale informatie uit als gegevens of geluid.,,IfcFlowTerminal,9abafcf8-704e-46c5-95c9-c9134e1a3e62,IfcElectricalDomain
IfcDistributionBoard,IfcDistributionBoard,,Distribution Board,Distributie bord,"A distribution board is a flow controller in which instances of electrical or communication devices are brought together at a single place for a particular purpose.; A distribution provides a housing for connected distribution elements so that they can be viewed, operated or acted upon from a single place. Each connected item may have its own geometric representation and location.; [[Attributes]]; PredefinedType; Formal Propositions; CorrectPredefinedType; Either the _PredefinedType_ attribute is unset(e.g. because an _IfcDistributionBoardType_ is associated), or the inherited attribute _ObjectType_ shall be provided, if the _PredefinedType_ is set to [[USERDEFINED]].; CorrectTypeAssigned; Either there is no type object associated, i.e. the _IsTypedBy_ inverse relationship is not provided, or the associated type object has to be of type _IfcDistributionBoardType_.;",Een distributiekanaal is een stroomcontroleur waarbij elektrische of communicatiemiddelen op één plaats worden samengebracht voor een bepaald doel.,,IfcFlowController,a721822d-2cbd-456f-8867-a69515d99d8f,IfcElectricalDomain
IfcElectricAppliance,IfcElectricAppliance,,Electric Appliance,Elektrische apparaat,An electric appliance is a device intended for consumer usage that is powered by electricity.; Electric appliances may be fixed in place or may be able to be moved from one space to another. Electric appliances require an electrical supply that may be supplied either by an electrical circuit or provided from a local battery source.; >,Een elektrische apparaat is een apparaat dat is bedoeld voor verbruiksgebruik dat wordt gevoed door elektriciteit.,,IfcFlowTerminal,bc624491-56a2-49ed-bb31-ca4b61c8deb5,IfcElectricalDomain
IfcElectricFlowStorageDevice,IfcElectricFlowStorageDevice,,Electric Flow Storage Device,Elektrische flow opslagapparaat,An electric flow storage device is a device in which electrical energy is stored and from which energy may be progressively released.; >,Een elektrische stroomopslagapparaat is een apparaat waarin elektrische energie wordt opgeslagen en waaruit geleidelijk energie kan worden vrijgegeven.,,IfcFlowStorageDevice,f2443c0e-5c57-46d2-83fe-668bd3d3367a,IfcElectricalDomain
IfcElectricFlowTreatmentDevice,IfcElectricFlowTreatmentDevice,,Electric Flow Treatment Device,Elektrisch Stroom Behandeling Apparaat,"An electric flow treatment device is used to remove unwanted matter from an electric or electronic signal in a flow distribution system.; [[Attributes]]; PredefinedType; Formal Propositions; CorrectPredefinedType; Either the _PredefinedType_ attribute is unset(e.g. because an _IfcElectricFlowTreatmentDeviceType_ is associated), or the inherited attribute _ObjectType_ shall be provided, if the _PredefinedType_ is set to [[USERDEFINED]].; CorrectTypeAssigned; Either there is no type object associated, i.e. the _IsTypedBy_ inverse relationship is not provided, or the associated type object has to be of type _IfcElectricFlowTreatmentDeviceType_.;",Een elektrische stroomverwerkingsapparaat wordt gebruikt om ongewenste stoffen uit een elektrisch of elektronisch signaal in een stroomdistributiesysteem te verwijderen.,,IfcFlowTreatmentDevice,766f42c3-db3e-4c48-bc16-2daec634f10f,IfcElectricalDomain
IfcElectricGenerator,IfcElectricGenerator,,Electric Generator,Elektrische Generator,An electric generator is an engine that is a machine for converting mechanical energy into electrical energy.; >,Een elektrische generator is een motor die een machine is voor het omzetten van mechanische energie in elektrische energie.,,IfcEnergyConversionDevice,ae4d0c52-31d6-4d0e-9fc5-52a5d00577ab,IfcElectricalDomain
IfcElectricMotor,IfcElectricMotor,,Electric Motor,Elektrische Motor,An electric motor is an engine that is a machine for converting electrical energy into mechanical energy.; >,Een elektrische motor is een motor die een machine is om elektrische energie in mechanische energie om te zetten.,,IfcEnergyConversionDevice,71aa25c6-a4a6-41fc-aca4-a67875c0775c,IfcElectricalDomain
IfcElectricTimeControl,IfcElectricTimeControl,,Electric Time Control,Elektrische tijdcontrole,An electric time control is a device that applies control to the provision or flow of electrical energy over time.; >,Een elektrische tijdcontrole is een apparaat dat na verloop van tijd de controle op de voorziening of stroom van elektrische energie toepast.,,IfcFlowController,22f3011b-86c8-4c48-b29c-49619710ec39,IfcElectricalDomain
IfcJunctionBox,IfcJunctionBox,,Junction Box,Junction Box,"A junction box is an enclosure within which cables are connected.; Cables may be members of an electrical circuit (for electrical power systems) or be information carriers (in a telecommunications system). A junction box is typically intended to conceal a cable junction from sight, eliminate tampering or provide a safe place for electrical connection.; >",Een kruisdoos is een kast waarin kabels zijn aangesloten.,,IfcFlowFitting,15740639-43f5-4ce5-88d8-fe78d6a98f3c,IfcElectricalDomain
IfcLamp,IfcLamp,,Lamp,Lamp,A lamp is an artificial light source such as a light bulb or tube.; >,Een lamp is een kunstmatige lichtbron zoals een gloeilamp of buis.,,IfcFlowTerminal,7e9a3b99-a029-4ddf-b40f-2d971a9359c2,IfcElectricalDomain
IfcLightFixture,IfcLightFixture,,Light Fixture,Lichte Fixture,"A light fixture is a container that is designed for the purpose of housing one or more lamps and optionally devices that control, restrict or vary their emission.; >",Een lichtfixatie is een container die is ontworpen om een of meer lampen en optioneel bedienende apparaten te huisvesten beperken of variëren van hun emissie.,,IfcFlowTerminal,4b24357d-355f-45c6-a45d-60de71e8c1fb,IfcElectricalDomain
IfcMobileTelecommunicationsAppliance,IfcMobileTelecommunicationsAppliance,,Mobile Telecommunications Appliance,Mobiele Telecommunicatie-apparaat,"A mobile telecommunications appliance is a device that transmits, converts, amplifies or receives signals used in mobile networks.;This entity is used to define specific appliances used in mobile telecommunication networks. General communications appliances and those used in fixed transmission networks should be instantiated using [[IfcCommunicationsAppliance]].; [[Attributes]]; PredefinedType; Formal Propositions; CorrectPredefinedType; Either the _PredefinedType_ attribute is unset(e.g. because an _IfcMobileTelecommunicationsApplianceType_ is associated), or the inherited attribute _ObjectType_ shall be provided, if the _PredefinedType_ is set to [[USERDEFINED]].; CorrectTypeAssigned; Either there is no type object associated, i.e. the _IsTypedBy_ inverse relationship is not provided, or the associated type object has to be of type _IfcMobileTelecommunicationsApplianceType_.;","Een mobiel telecommunicatieapparaat is een apparaat dat signalen die worden gebruikt in mobiele netwerken verzendt, omzet, uitbreidt of ontvangt. Deze entiteit wordt gebruikt om specifieke apparaten in mobiele telecommunicatienetwerken te definiëren. Algemene communicatie-apparaten en apparaten die in vaste transmissienetwerken worden geïnstantieerd met [[IfcCommunicationsAppliance]].",,IfcFlowTerminal,0c9eab05-74e7-4cf8-a5e4-3b8a1b697d9a,IfcElectricalDomain
IfcMotorConnection,IfcMotorConnection,,Motor Connection,Motor verbinding,A motor connection provides the means for connecting a motor as the driving device to the driven device.; >,Een motorverbinding biedt de middelen om een motor als rijder apparaat aan te sluiten op het gemotoriseerde apparaat.,,IfcEnergyConversionDevice,bcce8211-26c2-4b8d-995d-b68177b22846,IfcElectricalDomain
IfcOutlet,IfcOutlet,,Outlet,Contactdoos,"An outlet is a device installed at a point to receive one or more inserted plugs for electrical power or communications.; [[Power]] outlets are commonly connected within a junction box; data outlets may be directly connected to a wall. For power outlets sharing the same circuit within a junction box, the ports should indicate the logical wiring relationship to the enclosing junction box, even though they may be physically connected to a cable going to another outlet, switch, or fixture.; >",Een uitlaat is op een punt geïnstalleerd om één of meer aangesloten stekkers te ontvangen voor stroom of communicatie.,,IfcFlowTerminal,323a5119-6f96-4712-87e3-abaf2ac04b6f,IfcElectricalDomain
IfcProtectiveDevice,IfcProtectiveDevice,,Protective Device,Beschermend apparaat,"A protective device breaks an electrical circuit when a stated electric current that passes through it is exceeded.; A protective device provides protection against electrical current only (not as a general protective device). It may be used to represent the complete set of elements including both the tripping unit and the breaking unit that provide the protection. This may be particularly useful at earlier stages of design where the approach to breaking the electrical supply may be determined but the method of tripping may not. Alternatively, this entity may be used to specifically represent the breaking unit alone (in which case the tripping unit will also be specifically identified). This entity is specific to dedicated protective devices and excludes electrical outlets that may have circuit protection.; >","Een beschermend apparaat breekt een elektrisch circuit wanneer een vermelde elektrische stroom die erdoorheen gaat, wordt overschreden.",,IfcFlowController,a1202643-3e89-4bf3-9677-82067cb12ecb,IfcElectricalDomain
IfcProtectiveDeviceTrippingUnit,IfcProtectiveDeviceTrippingUnit,,Protective Device Tripping Unit,,A protective device tripping unit breaks an electrical circuit at a separate breaking unit when a stated electric current that passes through the unit is exceeded.; >,,,IfcDistributionControlElement,a8488154-175e-4eda-b9b6-157a9fa9cafe,
IfcSolarDevice,IfcSolarDevice,,Solar Device,Zonne-energie apparaat,A solar device converts solar radiation into other energy such as electric current or thermal energy.; >,Een zonneapparaat zet zonnestraling om in andere energie zoals stroom- of thermische energie.,,IfcEnergyConversionDevice,509208ea-e863-454b-9bd2-3fdf0c7dbac6,IfcElectricalDomain
IfcSwitchingDevice,IfcSwitchingDevice,,Switching Device,Schakelen van apparaat,"A switch is used in a cable distribution system (electrical circuit) to control or modulate the flow of electricity.; Switches include those used for electrical power, communications, audio-visual, or other distribution system types as determined by the available ports.; >",Er wordt een schakelaar gebruikt in een kabeldistributiesysteem (elektrisch circuit) om de stroom van elektriciteit te controleren of te moduleren.,,IfcFlowController,ddf82f58-8d9d-4781-b90f-d27aca153c7f,IfcElectricalDomain
IfcTransformer,IfcTransformer,,Transformer,Transformator,"A transformer is an inductive stationary device that transfers electrical energy from one circuit to another.; _IfcTransformer_ is used to transform electric power;_IfcController_ converts arbitrary signals, _IfcAudioVisualAppliance_ converts signals for audio or video streams, and _IfcCommunicationsAppliance_ converts signals for data or other communications usage.; >",Een transformator is een inductief stationair apparaat dat elektrische energie van het ene circuit naar het andere stuurt.,,IfcEnergyConversionDevice,328058af-09ed-4f92-a541-5232e28d6f02,IfcElectricalDomain
IfcAirTerminal,IfcAirTerminal,,Air Terminal,Ventilatieopening,An air terminal is a terminating or origination point for the transfer of air between distribution system(s) and one or more spaces. It can also be used for the transfer of air between adjacent spaces.; >,Een luchtterminal is een eindpunt of origineel punt voor het overbrengen van lucht tussen distributiesysteem en een of meer ruimten. Het kan ook worden gebruikt voor het overbrengen van lucht tussen aangrenzende ruimten.,,IfcFlowTerminal,d5bfe2e5-0796-4a25-98a1-7484e7d2f7e8,IfcHvacDomain
IfcAirTerminalBox,IfcAirTerminalBox,,Air Terminal Box,Ventilatieunit,An air terminal box typically participates in an HVAC duct distribution system and is used to control or modulate the amount of air delivered to its downstream ductwork. An air terminal box type is often referred to as an 'air flow regulator'.; >,Een luchtterminalbox neemt doorgaans deel aan een HVAC kanaal distributie systeem en wordt gebruikt om de hoeveelheid lucht geleverd in de stroomafwaarts gelegen ductwork te beheren of aan te passen. Een air terminaltype wordt vaak aangeduid als een 'air flow regulator'.,,IfcFlowController,5c94650b-db68-4716-a299-3069c0a7a43b,IfcHvacDomain
IfcAirToAirHeatRecovery,IfcAirToAirHeatRecovery,,Air to Air Heat Recovery,Lucht naar luchtwarmteherstel,"An air-to-air heat recovery device employs a counter-flow heat exchanger between inbound and outbound air flow. It is typically used to transfer heat from warmer air in one chamber to cooler air in the second chamber (i.e., typically used to recover heat from the conditioned air being exhausted and the outside air being supplied to a building), resulting in energy savings from reduced heating (or cooling) requirements.; >","Een apparaat voor lucht-warmte gebruikt een warmtewisselende tegenstroom tussen inkomende en uitgaande luchtstroom. Het wordt meestal gebruikt om warmte van warmere lucht in één kamer naar koele lucht in de tweede kamer te verplaatsen. ., meestal gebruikt om warmte te herstellen uit de geëigende lucht die uitgeput is en de buitenlucht wordt geleverd aan een gebouw), resulteert in energiebesparende vereisten voor lagere verwarming (of koeling)",,IfcEnergyConversionDevice,c3b0db60-6c85-4fba-9efe-5d2a04a9e3d3,IfcHvacDomain
IfcBoiler,IfcBoiler,,Boiler,Ketel,"A boiler is a closed, pressure-rated vessel in which water or other fluid is heated using an energy source such as natural gas, heating oil, or electricity. The fluid in the vessel is then circulated out of the boiler for use in various processes or heating applications.; _IfcBoiler_ is a vessel solely used for heating of water or other fluids. Storage vessels, such as for drinking water storage are considered as tanks and use the _IfcTank_ entity.; >",Een ketel is een gesloten schip met druk op de ketel waar water of andere vloeistof wordt verwarmd met behulp van een energiebron zoals aardgas. verwarming olie of elektriciteit. De vloeistof in het schip wordt vervolgens via de ketel verspreid voor gebruik in verschillende processen of verwarmingstoepassingen.,,IfcEnergyConversionDevice,bf8bb360-a4b6-4854-88b5-78c7f9524139,IfcHvacDomain
IfcBurner,IfcBurner,,Burner,Brander,"A burner is a device that converts fuel into heat through combustion. It includes gas, oil, and wood burners.; >","Een verbrandingsinstallatie is een apparaat dat brandstof omzet in warmte door verbranding. Het omvat gas, olie en houtverbrandingen.",,IfcEnergyConversionDevice,8801203d-3144-4447-8539-793ff1689a2d,IfcHvacDomain
IfcChiller,IfcChiller,,Chiller,Koeltjes,"A chiller is a device used to remove heat from a liquid via a vapor-compression or absorption refrigeration cycle to cool a fluid, typically water or a mixture of water and glycol. The chilled fluid is then used to cool and dehumidify air in a building.; >",Een koelkast is een apparaat dat gebruikt wordt om hitte van een vloeistof te verwijderen via een vapor-compressie of absorptie koelcyclus om een vloeistof te koelen. Meestal water of een mengsel van water en glycol. De koelvloeistof wordt dan gebruikt om de lucht in een gebouw te koelen en te ontvochtigen.,,IfcEnergyConversionDevice,bf2c24c4-224c-4662-8805-9a9d469e11d1,IfcHvacDomain
IfcCoil,IfcCoil,,Coil,Koel,"A coil is a device used to provide heat transfer between non-mixing media. A common example is a cooling coil, which utilizes a finned coil in which circulates chilled water, antifreeze, or refrigerant that is used to remove heat from air moving across the surface of the coil. A coil may be used either for heating or cooling purposes by placing a series of tubes (the coil) carrying a heating or cooling fluid into an airstream. The coil may be constructed from tubes bundled in a serpentine form or from finned tubes that give a extended heat transfer surface.; Coils may also be used for non-airflow cases such as embedded in a floor slab.; >","Een spoel is een apparaat dat wordt gebruikt om warmteoverdracht tussen niet-mengende media aan te bieden. Een algemeen voorbeeld is een koelkoelkast, dat gebruik maakt van een bevinde olie die koelwater circuleert. antivries, of koelmiddel dat wordt gebruikt om warmte te verwijderen uit de lucht die over het oppervlak van de kol beweegt. Een spoel kan worden gebruikt voor het verwarmen of koelen door een reeks buizen (de koek) te plaatsen met een verwarmings- of koelvloeistof in een luchtstroom. De spoel kan worden gebouwd uit buizen gebundeld in een serpentine vorm of uit bevinde buizen die een uitgebreid oppervlak voor warmteoverdracht geven.",,IfcEnergyConversionDevice,e4ba657e-5119-477a-adcc-96b3366a3658,IfcHvacDomain
IfcCompressor,IfcCompressor,,Compressor,Compressor,A compressor is a device that compresses a fluid typically used in a refrigeration circuit.; >,Een compressor is een apparaat dat een vloeistof gewoonlijk gebruikt in een koelcircuit comprimeert.,,IfcFlowMovingDevice,d8aab68b-f996-419d-8d96-d62a306be289,IfcHvacDomain
