Code,Entity,PredefinedType,Name,Entity_NL,Definition,Definition_NL,Description_NL,ParentClassCode,Uid,Domain
IfcTankBREAKPRESSURE,IfcTank,BREAKPRESSURE,Break Pressure,Pauze druk,"An open container that breaks the hydraulic pressure in a distribution system, typically located between the fluid reservoir and the fluid supply points. A typical break pressure tank allows the flow to discharge into the atmosphere, thereby reducing its hydrostatic pressure to zero.","Een open container die de hydraulische druk in een distributiesysteem doorbreekt, meestal gelegen tussen het vloeibare reservoir en de vloeibare aanvoerpunten. Een typische druktank maakt het mogelijk om de stroom in de atmosfeer te lozen, waardoor de waterstofdruk tot nul kan worden gereduceerd.","Technische opmerking: Omdat deze klasse een 'Vooraf gedefinieerd Type' is in IFC, wat een specialisatie van de bovenliggende klasse betekent, in IFC moet het worden vertegenwoordigd door de bovenliggende klasse, met alle relevante eigenschappen en kenmerken.",IfcTank,,IfcHvacDomain
IfcTankEXPANSION,IfcTank,EXPANSION,Expansion,Uitbreiding,"A closed container used in a closed fluid distribution system to mitigate the effects of thermal expansion or water hammer. The tank is typically constructed with a diaphragm dividing the tank into two sections, with fluid on one side of the diaphragm and air on the other. One example application is when connected to the primary circuit of a hot water system to accommodate the increase in volume of the water when it is heated.","Een gesloten container die wordt gebruikt in een gesloten waterdistributiesysteem om de effecten van thermische expansie of waterhamer te verzachten. De tank is meestal gebouwd met een diafragma die de tank onderdeelt in twee secties, met vloeistof aan de ene kant van het diafragma en de lucht aan de andere kant. Een voorbeeld is de aansluiting op het primaire circuit van een warm watersysteem om de toename van het volume van het water wanneer het wordt verwarmd, te compenseren.","Technische opmerking: Omdat deze klasse een 'Vooraf gedefinieerd Type' is in IFC, wat een specialisatie van de bovenliggende klasse betekent, in IFC moet het worden vertegenwoordigd door de bovenliggende klasse, met alle relevante eigenschappen en kenmerken.",IfcTank,,IfcHvacDomain
IfcTankFEEDANDEXPANSION,IfcTank,FEEDANDEXPANSION,Feed and Expansion,Feed en Uitbreiding,"An open tank that is used for both storage and thermal expansion. A typical example is a tank used to store make-up water at ambient pressure for supply to a hot water system, simultaneously accommodating increases in volume of the water when heated.",Een open tank die zowel voor opslag als voor thermische expansie wordt gebruikt. Een typisch voorbeeld is een tank die gebruikt wordt om make-up water op te slaan bij de omgevingsdruk op de toevoer naar een warm watersysteem. tegelijkertijd tegemoetkomen aan een toename van het volume van het water wanneer het wordt verwarmd.,"Technische opmerking: Omdat deze klasse een 'Vooraf gedefinieerd Type' is in IFC, wat een specialisatie van de bovenliggende klasse betekent, in IFC moet het worden vertegenwoordigd door de bovenliggende klasse, met alle relevante eigenschappen en kenmerken.",IfcTank,,IfcHvacDomain
IfcTankOILRETENTIONTRAY,IfcTank,OILRETENTIONTRAY,Oil Retention Tray,Zak voor olieonderhoud,An open container for environmental protection and storage of chemical products.,Een open container voor milieubescherming en opslag van chemische producten.,"Technische opmerking: Omdat deze klasse een 'Vooraf gedefinieerd Type' is in IFC, wat een specialisatie van de bovenliggende klasse betekent, in IFC moet het worden vertegenwoordigd door de bovenliggende klasse, met alle relevante eigenschappen en kenmerken.",IfcTank,,IfcHvacDomain
IfcTankPRESSUREVESSEL,IfcTank,PRESSUREVESSEL,Pressure Vessel,Druk Vaartuig,A closed container used for storing fluids or gases at a pressure different from the ambient pressure. A pressure vessel is typically rated by an authority having jurisdiction for the operational pressure.,Een gesloten container voor het opslaan van vloeistoffen of gassen onder andere druk dan de druk van de omgeving. Een drukschip wordt doorgaans beoordeeld doordat een autoriteit jurisdictie heeft over de operationele druk.,"Technische opmerking: Omdat deze klasse een 'Vooraf gedefinieerd Type' is in IFC, wat een specialisatie van de bovenliggende klasse betekent, in IFC moet het worden vertegenwoordigd door de bovenliggende klasse, met alle relevante eigenschappen en kenmerken.",IfcTank,,IfcHvacDomain
IfcTankSTORAGE,IfcTank,STORAGE,Storage,Opslagruimte,"An open or closed container used for storing a fluid at ambient pressure and from which it can be supplied to the fluid distribution system. There are many examples of storage tanks, such as potable water storage tanks, fuel storage tanks, etc.","Een open of gesloten container gebruikt voor het opslaan van een vloeistof bij omgevingsdruk en kan worden geleverd aan het vloeibare distributiesysteem. Er zijn veel voorbeelden van opslagtanks, zoals tanks, tanks, brandstofopslagtanks voor drinkwater, enzovoort.","Technische opmerking: Omdat deze klasse een 'Vooraf gedefinieerd Type' is in IFC, wat een specialisatie van de bovenliggende klasse betekent, in IFC moet het worden vertegenwoordigd door de bovenliggende klasse, met alle relevante eigenschappen en kenmerken.",IfcTank,,IfcHvacDomain
IfcTankVESSEL,IfcTank,VESSEL,Vessel,Vaartuig,An arbitrary closed tank type.,Een willekeurig gesloten tank type.,"Technische opmerking: Omdat deze klasse een 'Vooraf gedefinieerd Type' is in IFC, wat een specialisatie van de bovenliggende klasse betekent, in IFC moet het worden vertegenwoordigd door de bovenliggende klasse, met alle relevante eigenschappen en kenmerken.",IfcTank,,IfcHvacDomain
IfcTubeBundleFINNED,IfcTubeBundle,FINNED,Finned,Geslaagd,Finned tube bundle type.,Afgeronde buis bundeltype,"Technische opmerking: Omdat deze klasse een 'Vooraf gedefinieerd Type' is in IFC, wat een specialisatie van de bovenliggende klasse betekent, in IFC moet het worden vertegenwoordigd door de bovenliggende klasse, met alle relevante eigenschappen en kenmerken.",IfcTubeBundle,,IfcHvacDomain
IfcUnitaryEquipmentAIRCONDITIONINGUNIT,IfcUnitaryEquipment,AIRCONDITIONINGUNIT,Air Conditioning Unit,Eenheid luchtvoorzieningen,A unitary packaged air-conditioning unit typically used in residential or light commercial applications.,Een unitaire verpakte airconditioningunit wordt meestal gebruikt in woningen of lichte commerciële toepassingen.,"Technische opmerking: Omdat deze klasse een 'Vooraf gedefinieerd Type' is in IFC, wat een specialisatie van de bovenliggende klasse betekent, in IFC moet het worden vertegenwoordigd door de bovenliggende klasse, met alle relevante eigenschappen en kenmerken.",IfcUnitaryEquipment,,IfcHvacDomain
IfcUnitaryEquipmentAIRHANDLER,IfcUnitaryEquipment,AIRHANDLER,Air Handler,Lucht Handler,"A unitary air handling unit typically containing a fan, economizer, and coils.","Een eenheid voor de luchtafhandeling bevat doorgaans een fan, zuinig en kogels.","Technische opmerking: Omdat deze klasse een 'Vooraf gedefinieerd Type' is in IFC, wat een specialisatie van de bovenliggende klasse betekent, in IFC moet het worden vertegenwoordigd door de bovenliggende klasse, met alle relevante eigenschappen en kenmerken.",IfcUnitaryEquipment,,IfcHvacDomain
IfcUnitaryEquipmentDEHUMIDIFIER,IfcUnitaryEquipment,DEHUMIDIFIER,Dehumidifier,Ontvochtiger,"A unitary packaged dehumidification unit.units supporting multiple modes (dehumidification, cooling, and/or heating) should use AIRCONDITIONINGUNIT.","Een unitaire verpakte ontvochtigingseenheid.eenheden die meerdere modi ondersteunen (ontvochtiging, koeling, en/of verwarming) moeten AIRCONDITIONINGUNIT gebruiken.","Technische opmerking: Omdat deze klasse een 'Vooraf gedefinieerd Type' is in IFC, wat een specialisatie van de bovenliggende klasse betekent, in IFC moet het worden vertegenwoordigd door de bovenliggende klasse, met alle relevante eigenschappen en kenmerken.",IfcUnitaryEquipment,,IfcHvacDomain
IfcUnitaryEquipmentROOFTOPUNIT,IfcUnitaryEquipment,ROOFTOPUNIT,Roof Top Unit,Dak bovenste eenheid,A packaged assembly that is either field-erected or manufactured atop the roof of a large residential or commercial building and acts as a unitary component.,Een verpakte assemblage die ofwel wordt opgericht of geproduceerd op het dak van een groot woon- of commercieel gebouw en fungeert als een unitair onderdeel.,"Technische opmerking: Omdat deze klasse een 'Vooraf gedefinieerd Type' is in IFC, wat een specialisatie van de bovenliggende klasse betekent, in IFC moet het worden vertegenwoordigd door de bovenliggende klasse, met alle relevante eigenschappen en kenmerken.",IfcUnitaryEquipment,,IfcHvacDomain
IfcUnitaryEquipmentSPLITSYSTEM,IfcUnitaryEquipment,SPLITSYSTEM,Split System,Systeem splitsen,"A system which separates the compressor from the evaporator, but acts as a unitary component typically within residential or light commercial applications.","Een systeem dat de compressor scheidt van de verdamper, maar werkt als unitaire component meestal binnen woningen of lichte commerciële toepassingen.","Technische opmerking: Omdat deze klasse een 'Vooraf gedefinieerd Type' is in IFC, wat een specialisatie van de bovenliggende klasse betekent, in IFC moet het worden vertegenwoordigd door de bovenliggende klasse, met alle relevante eigenschappen en kenmerken.",IfcUnitaryEquipment,,IfcHvacDomain
IfcValveAIRRELEASE,IfcValve,AIRRELEASE,Air Release,Lucht Release,Valve used to release air from a pipe or fitting.,Radiatorkraan gebruikt om lucht vrij te maken uit een pijp of pasvorm.,"Technische opmerking: Omdat deze klasse een 'Vooraf gedefinieerd Type' is in IFC, wat een specialisatie van de bovenliggende klasse betekent, in IFC moet het worden vertegenwoordigd door de bovenliggende klasse, met alle relevante eigenschappen en kenmerken.",IfcValve,,IfcHvacDomain
IfcValveANTIVACUUM,IfcValve,ANTIVACUUM,Anti Vacuum,Anti vacuüm,Valve that opens to admit air if the pressure falls below atmospheric pressure.,Radiatorkraan opent lucht als de druk onder de luchtdruk valt.,"Technische opmerking: Omdat deze klasse een 'Vooraf gedefinieerd Type' is in IFC, wat een specialisatie van de bovenliggende klasse betekent, in IFC moet het worden vertegenwoordigd door de bovenliggende klasse, met alle relevante eigenschappen en kenmerken.",IfcValve,,IfcHvacDomain
IfcValveCHANGEOVER,IfcValve,CHANGEOVER,Change Over,Verander over,Valve that enables flow to be switched between pipelines (3 or 4 port).,Radiatorkraan waarmee de stroom kan worden gewisseld tussen pijpleidingen (3 of 4 poort).,"Technische opmerking: Omdat deze klasse een 'Vooraf gedefinieerd Type' is in IFC, wat een specialisatie van de bovenliggende klasse betekent, in IFC moet het worden vertegenwoordigd door de bovenliggende klasse, met alle relevante eigenschappen en kenmerken.",IfcValve,,IfcHvacDomain
IfcValveCHECK,IfcValve,CHECK,Check,Controleer,Valve that permits water to flow in one direction only and is enclosed when there is no flow (2 port).,Radiatorkraan die het mogelijk maakt om water in één richting te stromen en gesloten is wanneer er geen stroom is (2 poort).,"Technische opmerking: Omdat deze klasse een 'Vooraf gedefinieerd Type' is in IFC, wat een specialisatie van de bovenliggende klasse betekent, in IFC moet het worden vertegenwoordigd door de bovenliggende klasse, met alle relevante eigenschappen en kenmerken.",IfcValve,,IfcHvacDomain
IfcValveCOMMISSIONING,IfcValve,COMMISSIONING,Commissioning,Ingebruikstelling,Valve used to facilitate commissioning of a system (2 port).,Radiatorkraan die gebruikt wordt om het gebruik van een systeem (2 poort) te vergemakkelijken.,"Technische opmerking: Omdat deze klasse een 'Vooraf gedefinieerd Type' is in IFC, wat een specialisatie van de bovenliggende klasse betekent, in IFC moet het worden vertegenwoordigd door de bovenliggende klasse, met alle relevante eigenschappen en kenmerken.",IfcValve,,IfcHvacDomain
IfcValveDIVERTING,IfcValve,DIVERTING,Diverting,Omkeren,Valve that enables flow to be diverted from one branch of a pipeline to another (3 port).,Radiatorkraan die het mogelijk maakt om de stroom van een bepaalde tak van een pijpleiding naar een andere (3 poort) te verplaatsen.,"Technische opmerking: Omdat deze klasse een 'Vooraf gedefinieerd Type' is in IFC, wat een specialisatie van de bovenliggende klasse betekent, in IFC moet het worden vertegenwoordigd door de bovenliggende klasse, met alle relevante eigenschappen en kenmerken.",IfcValve,,IfcHvacDomain
IfcValveDOUBLECHECK,IfcValve,DOUBLECHECK,Double Check,Dubbele controle,An assembly that incorporates two valves used to prevent backflow.,Een assemblage met twee Radiatorkranen die worden gebruikt om backflow te voorkomen.,"Technische opmerking: Omdat deze klasse een 'Vooraf gedefinieerd Type' is in IFC, wat een specialisatie van de bovenliggende klasse betekent, in IFC moet het worden vertegenwoordigd door de bovenliggende klasse, met alle relevante eigenschappen en kenmerken.",IfcValve,,IfcHvacDomain
IfcValveDOUBLEREGULATING,IfcValve,DOUBLEREGULATING,Double Regulating,Dubbele regelgeving,Valve used to facilitate regulation of fluid flow in a system.,Radiatorkraan wordt gebruikt om de regulering van de vloeistofstroom in een systeem te vergemakkelijken.,"Technische opmerking: Omdat deze klasse een 'Vooraf gedefinieerd Type' is in IFC, wat een specialisatie van de bovenliggende klasse betekent, in IFC moet het worden vertegenwoordigd door de bovenliggende klasse, met alle relevante eigenschappen en kenmerken.",IfcValve,,IfcHvacDomain
IfcValveDRAWOFFCOCK,IfcValve,DRAWOFFCOCK,Draw Off Cock,Uit nek tekenen,A valve used to remove fluid from a piping system.,Een Radiatorkraan gebruikt om vloeistof uit een buissysteem te verwijderen.,"Technische opmerking: Omdat deze klasse een 'Vooraf gedefinieerd Type' is in IFC, wat een specialisatie van de bovenliggende klasse betekent, in IFC moet het worden vertegenwoordigd door de bovenliggende klasse, met alle relevante eigenschappen en kenmerken.",IfcValve,,IfcHvacDomain
IfcValveFAUCET,IfcValve,FAUCET,Faucet,Faucet,Faucet valve typically used as a flow discharge.,Faucetventiel wordt doorgaans gebruikt als deblokkering van stromen.,"Technische opmerking: Omdat deze klasse een 'Vooraf gedefinieerd Type' is in IFC, wat een specialisatie van de bovenliggende klasse betekent, in IFC moet het worden vertegenwoordigd door de bovenliggende klasse, met alle relevante eigenschappen en kenmerken.",IfcValve,,IfcHvacDomain
IfcValveFLUSHING,IfcValve,FLUSHING,Flushing,Flussen,"Valve that flushes a predetermined quantity of water to cleanse a toilet, urinal, etc.","Radiatorkraan die een vooraf bepaalde hoeveelheid water spoelt om een toilet, urine, etc. te reinigen.","Technische opmerking: Omdat deze klasse een 'Vooraf gedefinieerd Type' is in IFC, wat een specialisatie van de bovenliggende klasse betekent, in IFC moet het worden vertegenwoordigd door de bovenliggende klasse, met alle relevante eigenschappen en kenmerken.",IfcValve,,IfcHvacDomain
IfcValveGASCOCK,IfcValve,GASCOCK,Gas Cock,Gas ock,Valve that is used for controlling the flow of gas.,Radiatorkraan die wordt gebruikt om de gasstroom te beheersen.,"Technische opmerking: Omdat deze klasse een 'Vooraf gedefinieerd Type' is in IFC, wat een specialisatie van de bovenliggende klasse betekent, in IFC moet het worden vertegenwoordigd door de bovenliggende klasse, met alle relevante eigenschappen en kenmerken.",IfcValve,,IfcHvacDomain
IfcValveGASTAP,IfcValve,GASTAP,Gas Tap,Gas Tik,Gas tap typically used for venting or discharging gas from a system.,Gaskraan wordt meestal gebruikt om gas uit een systeem te ontladen of te ontladen.,"Technische opmerking: Omdat deze klasse een 'Vooraf gedefinieerd Type' is in IFC, wat een specialisatie van de bovenliggende klasse betekent, in IFC moet het worden vertegenwoordigd door de bovenliggende klasse, met alle relevante eigenschappen en kenmerken.",IfcValve,,IfcHvacDomain
IfcValveISOLATING,IfcValve,ISOLATING,Isolating,Isoleren,Valve that closes off flow in a pipeline.,Radiatorkraan die de off flow in een pijplijn afsluit.,"Technische opmerking: Omdat deze klasse een 'Vooraf gedefinieerd Type' is in IFC, wat een specialisatie van de bovenliggende klasse betekent, in IFC moet het worden vertegenwoordigd door de bovenliggende klasse, met alle relevante eigenschappen en kenmerken.",IfcValve,,IfcHvacDomain
IfcValveMIXING,IfcValve,MIXING,Mixing,Mixen,Valve that enables flow from two branches of a pipeline to be mixed together (3 port).,Radiatorkraan waarmee de stroom van twee takken van een pijpleiding kan worden gemengd (3 poort).,"Technische opmerking: Omdat deze klasse een 'Vooraf gedefinieerd Type' is in IFC, wat een specialisatie van de bovenliggende klasse betekent, in IFC moet het worden vertegenwoordigd door de bovenliggende klasse, met alle relevante eigenschappen en kenmerken.",IfcValve,,IfcHvacDomain
IfcValvePRESSUREREDUCING,IfcValve,PRESSUREREDUCING,Pressure Reducing,Drukverlaging,Valve that reduces the pressure of a fluid immediately downstream of its position in a pipeline to a preselected value or by a predetermined ratio.,Radiatorkraan die de druk vermindert van een vloeistof onmiddellijk stroomafwaarts van zijn positie in een pijpleiding naar een vooraf gekozen waarde of door een vooraf bepaalde ratio.,"Technische opmerking: Omdat deze klasse een 'Vooraf gedefinieerd Type' is in IFC, wat een specialisatie van de bovenliggende klasse betekent, in IFC moet het worden vertegenwoordigd door de bovenliggende klasse, met alle relevante eigenschappen en kenmerken.",IfcValve,,IfcHvacDomain
IfcValvePRESSURERELIEF,IfcValve,PRESSURERELIEF,Pressure Relief,Druknood,Spring or weight loaded valve that automatically discharges to a safe place fluid that has built up to excessive pressure in pipes or fittings.,Lente of gewichtsklep die automatisch leent naar een veilige stofvloeistof die heeft gebouwd aan excessieve druk in buizen of fittingen.,"Technische opmerking: Omdat deze klasse een 'Vooraf gedefinieerd Type' is in IFC, wat een specialisatie van de bovenliggende klasse betekent, in IFC moet het worden vertegenwoordigd door de bovenliggende klasse, met alle relevante eigenschappen en kenmerken.",IfcValve,,IfcHvacDomain
IfcValveREGULATING,IfcValve,REGULATING,Regulating,Regeling,Valve used to facilitate regulation of fluid flow in a system.,Radiatorkraan wordt gebruikt om de regulering van de vloeistofstroom in een systeem te vergemakkelijken.,"Technische opmerking: Omdat deze klasse een 'Vooraf gedefinieerd Type' is in IFC, wat een specialisatie van de bovenliggende klasse betekent, in IFC moet het worden vertegenwoordigd door de bovenliggende klasse, met alle relevante eigenschappen en kenmerken.",IfcValve,,IfcHvacDomain
IfcValveSAFETYCUTOFF,IfcValve,SAFETYCUTOFF,Safety Cut Off,Veiligheidsgesneden uit,"Valve that closes under the action of a safety mechanism such as a drop weight, solenoid etc.","Radiatorkraan sluit onder de werking van een veiligheidsmechanisme zoals een druppelgewicht, solenoïde etc.","Technische opmerking: Omdat deze klasse een 'Vooraf gedefinieerd Type' is in IFC, wat een specialisatie van de bovenliggende klasse betekent, in IFC moet het worden vertegenwoordigd door de bovenliggende klasse, met alle relevante eigenschappen en kenmerken.",IfcValve,,IfcHvacDomain
IfcValveSTEAMTRAP,IfcValve,STEAMTRAP,Steamtrap,Steamval,Valve that restricts flow of steam while allowing condensate to pass through.,Radiatorkraan die de stoomstroom beperkt terwijl de condensatie doorgaat.,"Technische opmerking: Omdat deze klasse een 'Vooraf gedefinieerd Type' is in IFC, wat een specialisatie van de bovenliggende klasse betekent, in IFC moet het worden vertegenwoordigd door de bovenliggende klasse, met alle relevante eigenschappen en kenmerken.",IfcValve,,IfcHvacDomain
IfcValveSTOPCOCK,IfcValve,STOPCOCK,Stop Cock,Stop ock,An isolating valve used on a domestic water service.,Een afsluitende ventiel die gebruikt wordt op een huishoudelijke waterdienst.,"Technische opmerking: Omdat deze klasse een 'Vooraf gedefinieerd Type' is in IFC, wat een specialisatie van de bovenliggende klasse betekent, in IFC moet het worden vertegenwoordigd door de bovenliggende klasse, met alle relevante eigenschappen en kenmerken.",IfcValve,,IfcHvacDomain
IfcVibrationIsolatorBASE,IfcVibrationIsolator,BASE,Base,Basis,Base isolator preventing transfer of energy from the ground to the structure.,Basisisolator die de overdracht van energie van de grond naar de structuur verhindert.,"Technische opmerking: Omdat deze klasse een 'Vooraf gedefinieerd Type' is in IFC, wat een specialisatie van de bovenliggende klasse betekent, in IFC moet het worden vertegenwoordigd door de bovenliggende klasse, met alle relevante eigenschappen en kenmerken.",IfcVibrationIsolator,,IfcHvacDomain
IfcVibrationIsolatorCOMPRESSION,IfcVibrationIsolator,COMPRESSION,Compression,Compressie,Compression type vibration isolator.,Dynamisch type trillingsisolator.,"Technische opmerking: Omdat deze klasse een 'Vooraf gedefinieerd Type' is in IFC, wat een specialisatie van de bovenliggende klasse betekent, in IFC moet het worden vertegenwoordigd door de bovenliggende klasse, met alle relevante eigenschappen en kenmerken.",IfcVibrationIsolator,,IfcHvacDomain
IfcVibrationIsolatorSPRING,IfcVibrationIsolator,SPRING,Spring,Lente,Spring type vibration isolator.,Lente type trilling isolator.,"Technische opmerking: Omdat deze klasse een 'Vooraf gedefinieerd Type' is in IFC, wat een specialisatie van de bovenliggende klasse betekent, in IFC moet het worden vertegenwoordigd door de bovenliggende klasse, met alle relevante eigenschappen en kenmerken.",IfcVibrationIsolator,,IfcHvacDomain
IfcFireSuppressionTerminalBREECHINGINLET,IfcFireSuppressionTerminal,BREECHINGINLET,Breeching Inlet,Breekende Inlaat,Symmetrical pipe fitting that unites two or more inlets into a single pipe. A breeching inlet may be used on either a wet or dry riser. Used by fire services personnel for fast connection of fire appliance hose reels. May also be used for foam.,Symmetrische buis die twee of meer inlets verenigt in één pijp. Een brouwstof kan worden gebruikt op een natte of droge risant. Gebruikt door brandweerpersoneel voor een snelle verbinding van brandweerapparatuur. Kan ook gebruikt worden voor schuim.,"Technische opmerking: Omdat deze klasse een 'Vooraf gedefinieerd Type' is in IFC, wat een specialisatie van de bovenliggende klasse betekent, in IFC moet het worden vertegenwoordigd door de bovenliggende klasse, met alle relevante eigenschappen en kenmerken.",IfcFireSuppressionTerminal,,IfcPlumbingFireProtectionDomain
IfcFireSuppressionTerminalFIREHYDRANT,IfcFireSuppressionTerminal,FIREHYDRANT,Fire Hydrant,Brandkraan,"Device, fitted to a pipe, through which a temporary supply of water may be provided. May also be termed a stand pipe.","Apparaat, gemonteerd op een pijp, waarmee een tijdelijke watertoevoer kan worden geleverd. Meestal wordt een staande pijp genoemd.","Technische opmerking: Omdat deze klasse een 'Vooraf gedefinieerd Type' is in IFC, wat een specialisatie van de bovenliggende klasse betekent, in IFC moet het worden vertegenwoordigd door de bovenliggende klasse, met alle relevante eigenschappen en kenmerken.",IfcFireSuppressionTerminal,,IfcPlumbingFireProtectionDomain
IfcFireSuppressionTerminalFIREMONITOR,IfcFireSuppressionTerminal,FIREMONITOR,Fire Monitor,Vuur Monitor,Fire monitor.,Ontsla monitor.,"Technische opmerking: Omdat deze klasse een 'Vooraf gedefinieerd Type' is in IFC, wat een specialisatie van de bovenliggende klasse betekent, in IFC moet het worden vertegenwoordigd door de bovenliggende klasse, met alle relevante eigenschappen en kenmerken.",IfcFireSuppressionTerminal,,IfcPlumbingFireProtectionDomain
IfcFireSuppressionTerminalHOSEREEL,IfcFireSuppressionTerminal,HOSEREEL,Hose Reel,Brandslanghaspel,A supporting framework on which a hose may be wound.,Een ondersteunend kader waarbinnen een gat kan worden gevloeid.,"Technische opmerking: Omdat deze klasse een 'Vooraf gedefinieerd Type' is in IFC, wat een specialisatie van de bovenliggende klasse betekent, in IFC moet het worden vertegenwoordigd door de bovenliggende klasse, met alle relevante eigenschappen en kenmerken.",IfcFireSuppressionTerminal,,IfcPlumbingFireProtectionDomain
IfcFireSuppressionTerminalSPRINKLER,IfcFireSuppressionTerminal,SPRINKLER,Sprinkler,Sprinkler,Device for sprinkling water from a pipe under pressure over an area.,Apparaat voor het ontspoelen van water uit een pijp onder druk over een gebied.,"Technische opmerking: Omdat deze klasse een 'Vooraf gedefinieerd Type' is in IFC, wat een specialisatie van de bovenliggende klasse betekent, in IFC moet het worden vertegenwoordigd door de bovenliggende klasse, met alle relevante eigenschappen en kenmerken.",IfcFireSuppressionTerminal,,IfcPlumbingFireProtectionDomain
IfcFireSuppressionTerminalSPRINKLERDEFLECTOR,IfcFireSuppressionTerminal,SPRINKLERDEFLECTOR,Sprinkler Deflector,Sprinkler doorbuiger,Device attached to a sprinkler to deflect the water flow into a spread pattern to cover the required area.,Apparaat gekoppeld aan een sprinkler om de waterstroom om te zetten in een spreadpatroon om het benodigde gebied te bedekken.,"Technische opmerking: Omdat deze klasse een 'Vooraf gedefinieerd Type' is in IFC, wat een specialisatie van de bovenliggende klasse betekent, in IFC moet het worden vertegenwoordigd door de bovenliggende klasse, met alle relevante eigenschappen en kenmerken.",IfcFireSuppressionTerminal,,IfcPlumbingFireProtectionDomain
