Code,Entity,PredefinedType,Name,Entity_NL,Definition,Definition_NL,Description_NL,ParentClassCode,Uid,Domain
IfcBearingROLLER,IfcBearing,ROLLER,Roller,Roll-up,The bearing functionality is provided by one or more rollers that are placed between two plates.,De dreigende functionaliteit wordt geleverd door één of meer rollers die tussen twee platen geplaatst zijn.,"Technische opmerking: Omdat deze les een 'Vooraf gedefinieerd Type' is in IFC, wat een specialisatie van de bovenliggende klasse betekent, in IFC moet het worden vertegenwoordigd door de bovenliggende klasse, met alle relevante eigenschappen en kenmerken.",IfcBearing,,IfcSharedBldgElements
IfcBearingSPHERICAL,IfcBearing,SPHERICAL,Spherical,Sferische,The bearing functionality is provided by convex dome in a concave basin.,De schrijffunctionaliteit is beschikbaar door de convexe dome in een concave bekken.,"Technische opmerking: Omdat deze les een 'Vooraf gedefinieerd Type' is in IFC, wat een specialisatie van de bovenliggende klasse betekent, in IFC moet het worden vertegenwoordigd door de bovenliggende klasse, met alle relevante eigenschappen en kenmerken.",IfcBearing,,IfcSharedBldgElements
IfcColumnCOLUMN,IfcColumn,COLUMN,Column,Kolom,A usually vertical member that may be load bearing and requiring resistance to vertical forces by compression but also sometimes to lateral forces.,"Een normaal verticaal lid dat draadrichting kan laden en weerstand vereist tegen verticale krachten door compressie, maar soms ook tegen laterale troepen.","Technische opmerking: Omdat deze klasse een 'Vooraf gedefinieerd Type' is in IFC, wat een specialisatie van de bovenliggende klasse betekent, in IFC moet het worden vertegenwoordigd door de bovenliggende klasse, met alle relevante eigenschappen en kenmerken.",IfcColumn,,IfcSharedBldgElements
IfcColumnPIERSTEM,IfcColumn,PIERSTEM,Pier Stem,Pier Stem,"An individual vertical part of a pier, may be a simple column, i.e. no breakdown into segments or separate structural parts such as flanges and web(s), or may be an aggregation of segments and/or parts.","Een individueel verticaal deel van een pier, kan een eenvoudige kolom zijn, d.w.z. geen verdeling in segmenten of gescheiden structurele onderdelen zoals flansen en web(en), of kan een samenvoeging van segmenten en/of onderdelen zijn.","Technische opmerking: Omdat deze les een 'Vooraf gedefinieerd Type' is in IFC, wat een specialisatie van de bovenliggende klasse betekent, in IFC moet het worden vertegenwoordigd door de bovenliggende klasse, met alle relevante eigenschappen en kenmerken.",IfcColumn,,IfcSharedBldgElements
IfcColumnPIERSTEM_SEGMENT,IfcColumn,PIERSTEM_SEGMENT,Pier Stem Segment,Pier Stem Segment,A vertical segment of a pier column.,Een verticaal segment van een Pier kolom.,"Technische opmerking: Omdat deze les een 'Vooraf gedefinieerd Type' is in IFC, wat een specialisatie van de bovenliggende klasse betekent, in IFC moet het worden vertegenwoordigd door de bovenliggende klasse, met alle relevante eigenschappen en kenmerken.",IfcColumn,,IfcSharedBldgElements
IfcColumnPILASTER,IfcColumn,PILASTER,Pilaster,Pilaster,A column element embedded within a wall that can be required to be load bearing but may also only be used for decorative purposes.,Een kolomelement ingesloten binnen een muur die verplicht kan zijn om te laden richting maar ook alleen gebruikt kan worden voor decoratieve doeleinden.,"Technische opmerking: Omdat deze les een 'Vooraf gedefinieerd Type' is in IFC, wat een specialisatie van de bovenliggende klasse betekent, in IFC moet het worden vertegenwoordigd door de bovenliggende klasse, met alle relevante eigenschappen en kenmerken.",IfcColumn,,IfcSharedBldgElements
IfcColumnSTANDCOLUMN,IfcColumn,STANDCOLUMN,Stand Column,Pilaar,A column transmitting vertical loads from a superstructure to an arch below it.,Een kolom zendt verticale ladingen over van een superstructuur naar een arg.,"Technische opmerking: Omdat deze les een 'Vooraf gedefinieerd Type' is in IFC, wat een specialisatie van de bovenliggende klasse betekent, in IFC moet het worden vertegenwoordigd door de bovenliggende klasse, met alle relevante eigenschappen en kenmerken.",IfcColumn,,IfcSharedBldgElements
IfcCoveringCEILING,IfcCovering,CEILING,Ceiling,Plafond,The covering is used to represent a ceiling.,De dekking wordt gebruikt als plafond.,"Technische opmerking: Omdat deze les een 'Vooraf gedefinieerd Type' is in IFC, wat een specialisatie van de bovenliggende klasse betekent, in IFC moet het worden vertegenwoordigd door de bovenliggende klasse, met alle relevante eigenschappen en kenmerken.",IfcCovering,,IfcSharedBldgElements
IfcCoveringCLADDING,IfcCovering,CLADDING,Cladding,Gevelbekleding,The covering is used to represent a cladding.,De dekking wordt gebruikt als een clading.,"Technische opmerking: Omdat deze les een 'Vooraf gedefinieerd Type' is in IFC, wat een specialisatie van de bovenliggende klasse betekent, in IFC moet het worden vertegenwoordigd door de bovenliggende klasse, met alle relevante eigenschappen en kenmerken.",IfcCovering,,IfcSharedBldgElements
IfcCoveringCOPING,IfcCovering,COPING,Coping,Kopiëren,A protective capping or covering of a wall or a parapet.,Een beschermende capping of afdekking van een muur of een parapet.,"Technische opmerking: Omdat deze les een 'Vooraf gedefinieerd Type' is in IFC, wat een specialisatie van de bovenliggende klasse betekent, in IFC moet het worden vertegenwoordigd door de bovenliggende klasse, met alle relevante eigenschappen en kenmerken.",IfcCovering,,IfcSharedBldgElements
IfcCoveringFLOORING,IfcCovering,FLOORING,Flooring,Vloerafwerking,The covering is used to represent a flooring.,De dekking wordt gebruikt als een vloerkleding.,"Technische opmerking: Omdat deze les een 'Vooraf gedefinieerd Type' is in IFC, wat een specialisatie van de bovenliggende klasse betekent, in IFC moet het worden vertegenwoordigd door de bovenliggende klasse, met alle relevante eigenschappen en kenmerken.",IfcCovering,,IfcSharedBldgElements
IfcCoveringINSULATION,IfcCovering,INSULATION,Insulation,Isolatie,The covering is used to insulate an element for thermal or acoustic purposes.,De dekking wordt gebruikt om een element te isoleren voor thermische of akoestische doeleinden.,"Technische opmerking: Omdat deze les een 'Vooraf gedefinieerd Type' is in IFC, wat een specialisatie van de bovenliggende klasse betekent, in IFC moet het worden vertegenwoordigd door de bovenliggende klasse, met alle relevante eigenschappen en kenmerken.",IfcCovering,,IfcSharedBldgElements
IfcCoveringMEMBRANE,IfcCovering,MEMBRANE,Membrane,Membraan,"An impervious layer that could be used for e.g. roof covering (below tiling - that may be known as sarking etc.) or as a damp proof course membrane; also, waterproofing material on a bridge structure (typically on top of bridge slab).",Een ondoorgrondelijke laag die kan worden gebruikt voor bijvoorbeeld dakafdekking (onder de tegel) dat bekend staat als sarking etc. of als demp-bewijs voor het membrama; ook waterbestendig materiaal op een brugstructuur (meestal bovenop de brugslab).,"Technische opmerking: Omdat deze les een 'Vooraf gedefinieerd Type' is in IFC, wat een specialisatie van de bovenliggende klasse betekent, in IFC moet het worden vertegenwoordigd door de bovenliggende klasse, met alle relevante eigenschappen en kenmerken.",IfcCovering,,IfcSharedBldgElements
IfcCoveringMOLDING,IfcCovering,MOLDING,Molding,Molend,The covering is used to represent a molding being a strip of material to cover the transition of surfaces (often between wall cladding and ceiling).,De dekking wordt gebruikt om een weekdier als een strook materiaal aan te duiden om de overgang van oppervlakten te dekken (vaak tussen muurkleding en plafond).,"Technische opmerking: Omdat deze les een 'Vooraf gedefinieerd Type' is in IFC, wat een specialisatie van de bovenliggende klasse betekent, in IFC moet het worden vertegenwoordigd door de bovenliggende klasse, met alle relevante eigenschappen en kenmerken.",IfcCovering,,IfcSharedBldgElements
IfcCoveringROOFING,IfcCovering,ROOFING,Roofing,Dakwerk,The covering is used to represent a roof covering.,De dekking wordt gebruikt om een dak te bedekken.,"Technische opmerking: Omdat deze les een 'Vooraf gedefinieerd Type' is in IFC, wat een specialisatie van de bovenliggende klasse betekent, in IFC moet het worden vertegenwoordigd door de bovenliggende klasse, met alle relevante eigenschappen en kenmerken.",IfcCovering,,IfcSharedBldgElements
IfcCoveringSKIRTINGBOARD,IfcCovering,SKIRTINGBOARD,Skirting Board,Randisolatie,The covering is used to represent a skirting board being a strip of material to cover the transition between the wall cladding and the flooring.,De afdekking wordt gebruikt als een rokbord als een strip van materiaal om de overgang tussen de muurkleding en de vloer te dekken.,"Technische opmerking: Omdat deze les een 'Vooraf gedefinieerd Type' is in IFC, wat een specialisatie van de bovenliggende klasse betekent, in IFC moet het worden vertegenwoordigd door de bovenliggende klasse, met alle relevante eigenschappen en kenmerken.",IfcCovering,,IfcSharedBldgElements
IfcCoveringSLEEVING,IfcCovering,SLEEVING,Sleeving,Slaapstand,The covering is used to isolate a distribution element from a space in which it is contained.,De dekking wordt gebruikt om een distributie-element te isoleren van een ruimte waarin het is ingeperkt.,"Technische opmerking: Omdat deze les een 'Vooraf gedefinieerd Type' is in IFC, wat een specialisatie van de bovenliggende klasse betekent, in IFC moet het worden vertegenwoordigd door de bovenliggende klasse, met alle relevante eigenschappen en kenmerken.",IfcCovering,,IfcSharedBldgElements
IfcCoveringTOPPING,IfcCovering,TOPPING,Topping,Egalisatielaag,A layer of material used for leveling or flattening a surface.,Een laag van materiaal dat gebruikt wordt om een niveau te halen of een oppervlak af te vlakken.,"Technische opmerking: Omdat deze les een 'Vooraf gedefinieerd Type' is in IFC, wat een specialisatie van de bovenliggende klasse betekent, in IFC moet het worden vertegenwoordigd door de bovenliggende klasse, met alle relevante eigenschappen en kenmerken.",IfcCovering,,IfcSharedBldgElements
IfcCoveringWRAPPING,IfcCovering,WRAPPING,Wrapping,Cadeau,The covering is used for wrapping particularly of distribution elements using tape.,De dekking wordt met name gebruikt voor het inpakken van distributie-elementen met een bandje.,"Technische opmerking: Omdat deze les een 'Vooraf gedefinieerd Type' is in IFC, wat een specialisatie van de bovenliggende klasse betekent, in IFC moet het worden vertegenwoordigd door de bovenliggende klasse, met alle relevante eigenschappen en kenmerken.",IfcCovering,,IfcSharedBldgElements
IfcDoorBOOM_BARRIER,IfcDoor,BOOM_BARRIER,Boom Barrier,Slagboom,"A boom barrier (also known as a boom gate) is a bar, or pole pivoted to allow the boom to block vehicular or pedestrian access through a controlled point.","Een slagboom (ook bekend als afsluitboom, hefboom en bareel) is een balk, of de draaibare paal om de snelle toegang van voertuigen of voetgangers via een gecontroleerd punt te blokkeren.","Technische opmerking: Omdat deze klasse een 'Vooraf gedefinieerd Type' is in IFC, wat een specialisatie van de bovenliggende klasse betekent, in IFC moet het worden vertegenwoordigd door de bovenliggende klasse, met alle relevante eigenschappen en kenmerken.",IfcDoor,,IfcSharedBldgElements
IfcDoorDOOR,IfcDoor,DOOR,Door,Deur,"A standard door usually within a wall opening, as a door panel in a curtain wall, or as a 'free standing' door.","Normaal gesproken opent een deur binnen een muuropening, als een deurpaneel in een vliesgevel, of als een \""vrij staande\"" deur.","Technische opmerking: Omdat deze klasse een 'Vooraf gedefinieerd Type' is in IFC, wat een specialisatie van de bovenliggende klasse betekent, in IFC moet het worden vertegenwoordigd door de bovenliggende klasse, met alle relevante eigenschappen en kenmerken.",IfcDoor,,IfcSharedBldgElements
IfcDoorGATE,IfcDoor,GATE,Gate,Poort,A gate is a point of entry into a space usually within an opening in a fence. Or as a 'free standing' gate.,Een poort is een toegangspunt tot een plaats meestal binnen een opening in een hek. Of als een 'vrij staande' poort.,"Technische opmerking: Omdat deze klasse een 'Vooraf gedefinieerd Type' is in IFC, wat een specialisatie van de bovenliggende klasse betekent, in IFC moet het worden vertegenwoordigd door de bovenliggende klasse, met alle relevante eigenschappen en kenmerken.",IfcDoor,,IfcSharedBldgElements
IfcDoorTRAPDOOR,IfcDoor,TRAPDOOR,Trapdoor,Luik,A special door that lies horizonally in a slab opening. Often used for accessing cellar or attic.,Een speciale deur die horizontaal in een slabbetopening ligt. Vaak gebruikt om toegang te krijgen tot kelder of zolder,"Technische opmerking: Omdat deze klasse een 'Vooraf gedefinieerd Type' is in IFC, wat een specialisatie van de bovenliggende klasse betekent, in IFC moet het worden vertegenwoordigd door de bovenliggende klasse, met alle relevante eigenschappen en kenmerken.",IfcDoor,,IfcSharedBldgElements
IfcDoorTURNSTILE,IfcDoor,TURNSTILE,Turnstile,Toegangspoort,"A mechanical gate consisting of revolving arms, allowing only one person at a time to pass through.",Een mechanische poort die bestaat uit beweegbare delen en die slechts één persoon per keer doorlaat.,"Technische opmerking: Omdat deze klasse een 'Vooraf gedefinieerd Type' is in IFC, wat een specialisatie van de bovenliggende klasse betekent, in IFC moet het worden vertegenwoordigd door de bovenliggende klasse, met alle relevante eigenschappen en kenmerken.",IfcDoor,,IfcSharedBldgElements
IfcMemberARCH_SEGMENT,IfcMember,ARCH_SEGMENT,Arch Segment,Arch segment,Individual segment of an arch structure.,Individueel segment van een artsstructuur.,"Technische opmerking: Omdat deze les een 'Vooraf gedefinieerd Type' is in IFC, wat een specialisatie van de bovenliggende klasse betekent, in IFC moet het worden vertegenwoordigd door de bovenliggende klasse, met alle relevante eigenschappen en kenmerken.",IfcMember,,IfcSharedBldgElements
IfcMemberBRACE,IfcMember,BRACE,Brace,Kruid,A linear element (usually sloped) often used for bracing of a girder or truss.,Een lineair element (meestal helling) vaak gebruikt om een meisje of trusje te bergen.,"Technische opmerking: Omdat deze les een 'Vooraf gedefinieerd Type' is in IFC, wat een specialisatie van de bovenliggende klasse betekent, in IFC moet het worden vertegenwoordigd door de bovenliggende klasse, met alle relevante eigenschappen en kenmerken.",IfcMember,,IfcSharedBldgElements
IfcMemberCHORD,IfcMember,CHORD,Chord,Koord,"Upper or lower longitudinal member of a truss, used horizontally or sloped.","Bovenste of onderste longitudinaal lid van een truss, horizontaal gebruikt of helder.","Technische opmerking: Omdat deze les een 'Vooraf gedefinieerd Type' is in IFC, wat een specialisatie van de bovenliggende klasse betekent, in IFC moet het worden vertegenwoordigd door de bovenliggende klasse, met alle relevante eigenschappen en kenmerken.",IfcMember,,IfcSharedBldgElements
IfcMemberCOLLAR,IfcMember,COLLAR,Collar,Halterklem,A linear element (usually used horizontally) within a roof structure to connect rafters and posts.,Een lineair element (meestal horizontaal gebruikt) binnen een dakstructuur om rafters en berichten te verbinden.,"Technische opmerking: Omdat deze les een 'Vooraf gedefinieerd Type' is in IFC, wat een specialisatie van de bovenliggende klasse betekent, in IFC moet het worden vertegenwoordigd door de bovenliggende klasse, met alle relevante eigenschappen en kenmerken.",IfcMember,,IfcSharedBldgElements
IfcMemberMEMBER,IfcMember,MEMBER,Member,Lid,A linear element within a girder or truss with no further meaning.,Een lineair element bij een meisje of snoepje zonder betekenis.,"Technische opmerking: Omdat deze les een 'Vooraf gedefinieerd Type' is in IFC, wat een specialisatie van de bovenliggende klasse betekent, in IFC moet het worden vertegenwoordigd door de bovenliggende klasse, met alle relevante eigenschappen en kenmerken.",IfcMember,,IfcSharedBldgElements
IfcMemberMULLION,IfcMember,MULLION,Mullion,Stijl,A linear element within a curtain wall system to connect two (or more) panels.,Een lineair element in een gordijnen-muur systeem om twee (of meer) panelen te verbinden.,"Technische opmerking: Omdat deze les een 'Vooraf gedefinieerd Type' is in IFC, wat een specialisatie van de bovenliggende klasse betekent, in IFC moet het worden vertegenwoordigd door de bovenliggende klasse, met alle relevante eigenschappen en kenmerken.",IfcMember,,IfcSharedBldgElements
IfcMemberPLATE,IfcMember,PLATE,Plate,Regel,"A linear continuous horizontal element in wall framing, such as a head piece or a sole plate.","Een lineair continu horizontaal element in wandframing, zoals een kopstuk of een enkele plaat.","Technische opmerking: Omdat deze les een 'Vooraf gedefinieerd Type' is in IFC, wat een specialisatie van de bovenliggende klasse betekent, in IFC moet het worden vertegenwoordigd door de bovenliggende klasse, met alle relevante eigenschappen en kenmerken.",IfcMember,,IfcSharedBldgElements
IfcMemberPOST,IfcMember,POST,Post,Plaatsen,A linear (usually vertical) member used to support something or to mark a point.,Een lineair (meestal verticaal) lid wordt gebruikt om iets te ondersteunen of een punt te markeren.,"Technische opmerking: Omdat deze les een 'Vooraf gedefinieerd Type' is in IFC, wat een specialisatie van de bovenliggende klasse betekent, in IFC moet het worden vertegenwoordigd door de bovenliggende klasse, met alle relevante eigenschappen en kenmerken.",IfcMember,,IfcSharedBldgElements
IfcMemberPURLIN,IfcMember,PURLIN,Purlin,Gording,A linear element (usually used horizontally) within a roof structure to support rafters.,Een lineair element (meestal horizontaal gebruikt) binnen een dakstructuur om rafters te ondersteunen.,"Technische opmerking: Omdat deze les een 'Vooraf gedefinieerd Type' is in IFC, wat een specialisatie van de bovenliggende klasse betekent, in IFC moet het worden vertegenwoordigd door de bovenliggende klasse, met alle relevante eigenschappen en kenmerken.",IfcMember,,IfcSharedBldgElements
IfcMemberRAFTER,IfcMember,RAFTER,Rafter,Zeldzame,"A linear elements used to support roof slabs or roof covering, usually used with slope.","Een lineaire elementen die gebruikt worden om dakplaten of dakdekking te ondersteunen, meestal gebruikt met helling.","Technische opmerking: Omdat deze les een 'Vooraf gedefinieerd Type' is in IFC, wat een specialisatie van de bovenliggende klasse betekent, in IFC moet het worden vertegenwoordigd door de bovenliggende klasse, met alle relevante eigenschappen en kenmerken.",IfcMember,,IfcSharedBldgElements
IfcMemberSTAY_CABLE,IfcMember,STAY_CABLE,Stay Cable,Blijf kabel,A sloped element suspending a structure (such as bridge deck) from a pylon.,Een schuin element schort een structuur (zoals brugdek) van een pylon.,"Technische opmerking: Omdat deze les een 'Vooraf gedefinieerd Type' is in IFC, wat een specialisatie van de bovenliggende klasse betekent, in IFC moet het worden vertegenwoordigd door de bovenliggende klasse, met alle relevante eigenschappen en kenmerken.",IfcMember,,IfcSharedBldgElements
IfcMemberSTIFFENING_RIB,IfcMember,STIFFENING_RIB,Stiffening Rib,Stiffening Rib,A linear element added to a flange or a web plate of a girder for local stiffening.,Een lineair element toegevoegd aan een flens of een webplaat van een meisje voor lokale stijf.,"Technische opmerking: Omdat deze les een 'Vooraf gedefinieerd Type' is in IFC, wat een specialisatie van de bovenliggende klasse betekent, in IFC moet het worden vertegenwoordigd door de bovenliggende klasse, met alle relevante eigenschappen en kenmerken.",IfcMember,,IfcSharedBldgElements
IfcMemberSTRINGER,IfcMember,STRINGER,Stringer,Tekenreeks,"A linear element used to support stair or ramp flights, usually used with slope.","Een lineair element gebruikt om trap- of platformvluchten te ondersteunen, meestal gebruikt met helling.","Technische opmerking: Omdat deze les een 'Vooraf gedefinieerd Type' is in IFC, wat een specialisatie van de bovenliggende klasse betekent, in IFC moet het worden vertegenwoordigd door de bovenliggende klasse, met alle relevante eigenschappen en kenmerken.",IfcMember,,IfcSharedBldgElements
IfcMemberSTRUCTURALCABLE,IfcMember,STRUCTURALCABLE,Structural Cable,Structurele Kabel,"A linear cable element used to secure or stabilise a structure by resisting lateral and longitudinal loading through tension only, but cannot resist compression. usually formed of a flexible cable or wire.","Een lineair kabelelement dat gebruikt wordt om een structuur te beveiligen of te stabiliseren door het laterale en longitudinale laden alleen door spanning te weerstaan, maar kan compressie niet weerstaan. meestal gevormd door een flexibele kabel of draad.","Technische opmerking: Omdat deze les een 'Vooraf gedefinieerd Type' is in IFC, wat een specialisatie van de bovenliggende klasse betekent, in IFC moet het worden vertegenwoordigd door de bovenliggende klasse, met alle relevante eigenschappen en kenmerken.",IfcMember,,IfcSharedBldgElements
IfcMemberSTRUT,IfcMember,STRUT,Strut,Strut,A linear element often used within a girder or truss.,Een lineair element vaak gebruikt in een meisje of snoepje.,"Technische opmerking: Omdat deze les een 'Vooraf gedefinieerd Type' is in IFC, wat een specialisatie van de bovenliggende klasse betekent, in IFC moet het worden vertegenwoordigd door de bovenliggende klasse, met alle relevante eigenschappen en kenmerken.",IfcMember,,IfcSharedBldgElements
IfcMemberSTUD,IfcMember,STUD,Stud,Stud,Vertical element in wall framing.,Verticaal element in muurframing.,"Technische opmerking: Omdat deze les een 'Vooraf gedefinieerd Type' is in IFC, wat een specialisatie van de bovenliggende klasse betekent, in IFC moet het worden vertegenwoordigd door de bovenliggende klasse, met alle relevante eigenschappen en kenmerken.",IfcMember,,IfcSharedBldgElements
IfcMemberSUSPENDER,IfcMember,SUSPENDER,Suspender,Opschorter,A vertical element suspending a structure (such as bridge deck) from a suspension cable or an arch.,Een verticaal element schort een structuur (zoals brugdek) van een ophangkabel of een boog.,"Technische opmerking: Omdat deze les een 'Vooraf gedefinieerd Type' is in IFC, wat een specialisatie van de bovenliggende klasse betekent, in IFC moet het worden vertegenwoordigd door de bovenliggende klasse, met alle relevante eigenschappen en kenmerken.",IfcMember,,IfcSharedBldgElements
IfcMemberSUSPENSION_CABLE,IfcMember,SUSPENSION_CABLE,Suspension Cable,Schorsing Kabel,"A suspended element, typically comprising steel wire, sheath, etc.","Een opgeschorte element, meestal bestaande stalen draad, sheath, enz.","Technische opmerking: Omdat deze les een 'Vooraf gedefinieerd Type' is in IFC, wat een specialisatie van de bovenliggende klasse betekent, in IFC moet het worden vertegenwoordigd door de bovenliggende klasse, met alle relevante eigenschappen en kenmerken.",IfcMember,,IfcSharedBldgElements
IfcMemberTIEBAR,IfcMember,TIEBAR,Tiebar,Tiebar,A linear bar element used to secure or stabilise a structure by resisting lateral and longitudinal loading through tension and or compression. usually formed by a solid bar.,Een lineair bar-element gebruikt om een structuur te beveiligen of te stabiliseren door lateraal en langzaam-laden te weerstaan door spanning en compressie. meestal gevormd door een vaste balk.,"Technische opmerking: Omdat deze les een 'Vooraf gedefinieerd Type' is in IFC, wat een specialisatie van de bovenliggende klasse betekent, in IFC moet het worden vertegenwoordigd door de bovenliggende klasse, met alle relevante eigenschappen en kenmerken.",IfcMember,,IfcSharedBldgElements
IfcPlateBASE_PLATE,IfcPlate,BASE_PLATE,Base Plate,Standaard plaat,"A plate used to spread load over a surface, such as underneath a bearing or column.","Een plaat dat gebruikt wordt om de belasting over een oppervlak te verspreiden, zoals onder een lager of kolom.","Technische opmerking: Omdat deze les een 'Vooraf gedefinieerd Type' is in IFC, wat een specialisatie van de bovenliggende klasse betekent, in IFC moet het worden vertegenwoordigd door de bovenliggende klasse, met alle relevante eigenschappen en kenmerken.",IfcPlate,,IfcSharedBldgElements
IfcPlateCOVER_PLATE,IfcPlate,COVER_PLATE,Cover Plate,Afdeksel plaat,A plate (underneath or above) a flange to provide additional load capacity.,Een plaat (onder of hoger) een flens om extra belastingscapaciteit te bieden.,"Technische opmerking: Omdat deze les een 'Vooraf gedefinieerd Type' is in IFC, wat een specialisatie van de bovenliggende klasse betekent, in IFC moet het worden vertegenwoordigd door de bovenliggende klasse, met alle relevante eigenschappen en kenmerken.",IfcPlate,,IfcSharedBldgElements
IfcPlateCURTAIN_PANEL,IfcPlate,CURTAIN_PANEL,Curtain Panel,Gordijn Paneel,"A planar element within a curtain wall, often consisting of a frame with fixed glazing.","Een vlak element binnen een gordijn, vaak bestaat uit een frame met vaste glazing.","Technische opmerking: Omdat deze les een 'Vooraf gedefinieerd Type' is in IFC, wat een specialisatie van de bovenliggende klasse betekent, in IFC moet het worden vertegenwoordigd door de bovenliggende klasse, met alle relevante eigenschappen en kenmerken.",IfcPlate,,IfcSharedBldgElements
IfcPlateFLANGE_PLATE,IfcPlate,FLANGE_PLATE,Flange Plate,Flange Plate,A flange plate in linear members having box or I-profile (e.g. top or bottom flange plate in box-girder).,Een flusplaat in lineaire leden met doos of I-profiel (bijv. boven of onderste flens plaat in doos-meisje).,"Technische opmerking: Omdat deze les een 'Vooraf gedefinieerd Type' is in IFC, wat een specialisatie van de bovenliggende klasse betekent, in IFC moet het worden vertegenwoordigd door de bovenliggende klasse, met alle relevante eigenschappen en kenmerken.",IfcPlate,,IfcSharedBldgElements
